overall,asin,reviewText,time,year
4.0,0001844423,it's c.s. lewis. fantasy with morals--and witches and disease and magic and travels and travails and friends and worlds being created and ruins and fantastical creatures.,2015-04-18,2015
5.0,0001844423,"Loved the Narnia Chronicles, but the Boxen bonus book wasn't to my taste. Narnia should be required reading in elementary schools!",2015-04-18,2015
2.0,0001844423,"Writing is choppy and hard to follow. Not as good as the Lion, the Witch and the Wardrobe writing.",2015-04-14,2015
5.0,0001844423,"The Chronicles of Narnia are a fantastic series of books.  No child should go through life without the opportunity of stepping through a wardrobe, looking glass, or other door leading to the fancies of our imaginations.  This is a must have for the nine year-old and up crowd.",2015-04-13,2015
5.0,0001844423,My whole family are fans of the Chronicles of Narnia. I purchased this edition to replace a set that had been damaged.,2015-04-13,2015
4.0,0001844423,"delightful. imaginative. fun. kool...
I like the allegorical/mythological ref's

I'm an adult, and I appreciate esoteric/myth ... I think it's interesting that a fast-paced (somewhat-)modern children's (fairy-tale) anthology alludes to Christ & his story /saga.

I love how the main characters are relatable, though involved in such fantasy,
and the story told in an exciting, quick-paced, spirited way,
without being overly emotional.",2015-04-12,2015
5.0,0001844423,Well compiled and collected.,2015-04-11,2015
5.0,0001844423,"I enjoyed getting the back story to the movie. This was a quick, easy read. I would recommend this book.",2015-04-10,2015
5.0,0001844423,Every generation of kids LOVES this book!,2015-04-10,2015
1.0,0001844423,disappointed gift for a child the box set came taped together the books were yellowed and brittle and not usable(do I really have to give it a stsar?),2015-04-08,2015
5.0,0001844423,wondrous!,2015-04-08,2015
5.0,0001844423,Great alogory of faith. Not exactly theologically driven but great read.,2015-04-03,2015
5.0,0001844423,Excellent books! My kids love them!,2015-04-03,2015
5.0,0001844423,This is a marvelous collection. The performers really make the story come alive. My family also enjoyed the artwork on the cases. The tracks are fairly long so if you have to stop and eject the cd make sure it's near the beginning of a track.,2015-03-31,2015
5.0,0001844423,My kids very much enjoyed this. He couldn't put it down. Two day read for him.,2015-03-27,2015
5.0,0001844423,Lots of fun to read.  It doesn't matter if you are young or old everyone can enjoy the Narnia series.,2015-03-26,2015
5.0,0001844423,C.S. Lewis was an extraordinarily deep thinker. One benefits greatly from reading any of his works.,2015-03-24,2015
5.0,0001844423,Was B-Day gift for granddaughter.,2015-03-22,2015
5.0,0001844423,The best group of stories ever!,2015-03-20,2015
5.0,0001844423,A set of classics.  Life-changing.,2015-03-18,2015
5.0,0001844423,Fabulous.  You should acquire this set immediately.,2015-03-17,2015
5.0,0001844423,love it,2015-03-15,2015
5.0,0001844423,hard to stop reading,2015-03-14,2015
5.0,0001844423,awesome,2015-03-14,2015
4.0,0001844423,"Good book, however the stories are out of order as originally written by the author. It is a super large book with large print, like something you would give to a child.",2015-03-11,2015
5.0,0001844423,All my kids love these books. They have a timeless quality.,2015-03-11,2015
5.0,0001844423,"These are absolutely beautiful books.  The illustrations will make these stories, which are already wonderful, spring to life for both children and adults.",2015-03-10,2015
5.0,0001844423,like the set of book and it is in fine condition. Hoping to learn more from this volume.,2015-03-09,2015
5.0,0001844423,"As with the other books in the Narnia collection, Prince Caspian is an excellent piece of literature brimming with adventure and moral lessons we ought to be instilling in our children. Don't let Lewis' vocabulary (as it relates to his era and British culture) discourage you. My 6-year old and I are on book 4 and he is loving it. He quickly makes connections between Narnia and the real world, especially regarding Aslan's character and Jesus. I explain or elaborate when necessary or when he asks questions. I also skip words like ""ass"" when used as an adjective. ;-)",2015-03-09,2015
5.0,0001844423,A person never outgrows these books. They're all such a great adventure! I would recommend them for any person at any age.,2015-03-07,2015
3.0,0001844423,"After following these kids through adulthood the ending sucked. Quite frankly I don't think it could have ended any other way but I really was disappointed. It is extremely patriarchal and offensive to any feminist. Still, it's hard to read the series and not finish. I'm just that kind of person.",2015-03-06,2015
5.0,0001844423,Great book. Great condition. Great reading.,2015-03-06,2015
5.0,0001844423,"I love these books!  I've only had them a few weeks and have almost finished the series.  Very well written books, that even being an adult, you can enjoy.  I really like the way the author makes references to the Bible.  It was the main reason I wanted to start reading books by this author.
The books came with the cover illustrations pictured.  They are obviously worn, but still in good shape.
Extremely happy with my purchase.",2015-03-04,2015
5.0,0001844423,"This is the complete Chronicles of Narnia... not just the Aslan bits... All Works! Amazing beautiful leather bound copy with gold leafing on the pages and a silk ribbon to mark your page. This book was apart of the Barnes and Noble leather bound collectible series. However, this book is now completely out of print.",2015-03-04,2015
5.0,0001844423,"This is a terrific set, neat album holders and designs on each disc.  Very good sound quality.  The metal case is sturdy and attractive as well.",2015-03-03,2015
5.0,0001844423,Wonderfully packaged and fantastic rendition of the stories by Focus On The Family Radio Theatre!,2015-03-03,2015
5.0,0001844423,Thank you,2015-03-01,2015
5.0,0001844423,Cs Lewis makes this story action packed and makes you sit on the edge of your seat,2015-02-28,2015
5.0,0001844423,Very enjoyable!,2015-02-28,2015
4.0,0001844423,"A little slower than the other chronicles, but still enjoyable.",2015-02-28,2015
2.0,0001844423,"I ordered a hardcover, received a paperback book in excellent condition. I shall return the item for the item I desired to purchase. I assume this was just an accident, I expect to be a very satisfied customer soon enough.",2015-02-24,2015
5.0,0001844423,"I didn't realize that it was a Christian allegory for young people, but I enjoyed it anyway.  Very very sweet.",2015-02-24,2015
5.0,0001844423,ok,2015-02-23,2015
5.0,0001844423,"Great book, highly recommend",2015-02-22,2015
5.0,0001844423,"Great book, highly recommend",2015-02-22,2015
5.0,0001844423,"Great book, highly recommend",2015-02-22,2015
5.0,0001844423,"Great book, highly recommend",2015-02-22,2015
5.0,0001844423,Great.,2015-02-21,2015
5.0,0001844423,Love the books more than the movies.,2015-02-20,2015
5.0,0001844423,My granddaughter is enjoying her new set of books.,2015-02-20,2015
5.0,0001844423,I just love this book.  Was surprised at all of the additional books.,2015-02-20,2015
5.0,0001844423,great to have on hand - easy to read over and over again at any age.,2015-02-20,2015
4.0,0001844423,"I didn't realize this was the first book in the series so I had previously read The Lion The Witch and the Wardrobe.  This one was pretty good.  Digory and Polly were far from being insipid and intolerable children as I tend to expect.  I quite liked them, especially Polly insisting that Digory apologize for hurting her, his recognizing he had done wrong, and her graceful acceptance of his apology.

Jadis seemed a bit derivative, if C S Lewis had actually read any H P Lovecraft.  Or maybe she just reminded me of Joss Whedon's Illyria.  She was scary, no question.

This had some elements of deus ex machina such as the apple only working on Jadis in a certain way, and working a different way back in our world, but it's a children's fantasy so I'm not complaining much.",2015-02-17,2015
5.0,0001844423,"I purchased this for a 10-year old girl who is just beginning to build her library of favorite books. Really, this series is a must.",2015-02-16,2015
5.0,0001844423,This is possibly my second favorite book in the series.,2015-02-15,2015
5.0,0001844423,Perfect adolescent christmas gift!,2015-02-15,2015
5.0,0001844423,Excellent box set - a great gift for kids and adults alike.,2015-02-15,2015
5.0,0001844423,Great book for children and adults.  Interesting to see how Lewis wrote a prequel after the fact.  Stitched together ver well,2015-02-12,2015
5.0,0001844423,Kids loved this book.,2015-02-09,2015
5.0,0001844423,"Finally, instead of keeping track of 7 different paperbacks---which I will now give away---all of the CON are contained in one hardback which opens flat so that there is no page rollover.  I am delighted with this singular volume that puts each book in the author's preferred order. Now all I need are some Turkish delights;)",2015-02-05,2015
5.0,0001844423,This set is amazing and totally worth it. I love listening to these on CD. They were a replacement for another identical set I got but they became scratched  and damaged. I should have made a digital personal copy in case that happened but I did not. These are enjoyable for all ages I think. They are not dramatized so may seem slow if you are expecting a movie pace or something. They work great on long car rides or when doing chores. I like to listen to them as I paint. I love how each book is narrated by a different person.,2015-02-03,2015
4.0,0001844423,"I love the size of the print for my 66-year-old eyes.  I a enjoying revisiting this children's classic series.  I am opting to read them in the order that Lewis completed them, rather than the order that they are placed in the book.",2015-02-02,2015
5.0,0001844423,My daughter is really enjoying this series. She is in 6th grade. Love the Christian theme throughout.,2015-02-02,2015
5.0,0001844423,I loved these books as a child and read them over and over again.,2015-02-02,2015
5.0,0001844423,"I couldn't put the book down, I loved the beautiful christian parallels that stood out to me so boldly. I recommend this book",2015-02-01,2015
4.0,0001844423,"This is a great edition of the series.  Regardless of anyone's opinions about the order of reading the stories, these prints are of a good quality.  The paper is a heavier stock than your average checkout lane novel.  It's a pure white paper with a bit of stiffness to it.  The full color pictures are a nice touch.  They're randomly interspersed throughout the books and create a nice breakup of continuous typeset.  This box set means you won't have to carry around the big ""all-in-one"" edition.  We recommend buying it for your school aged children.",2015-01-28,2015
5.0,0001844423,Beautiful book - and the stories are great of course.,2015-01-28,2015
5.0,0001844423,This was a gift for my son and his 8-year-old daughter. They enjoyed reading it together.,2015-01-28,2015
5.0,0001844423,"It may not be as good as a Harry Potter book, but It was still really good. I love this book!",2015-01-22,2015
5.0,0001844423,I loved the tension and the cliff hangers. I I'm just a kid so that is all I got bye.,2015-01-20,2015
4.0,0001844423,"Its nice to have it all in one book with an attractive cover. Its better than Lord of The Rings. However, the the themes are a bit violent and reflective of the times. Most but not all stories would be appropriate for any age. Classics as a whole, but not perfect stories. The writing is very funny and reminds me of Roald Dahl. None of the stories are as good as the first Harry Potter book. Entertaining and would make a good gift, especially at Christmas. I think every child deserves to think of themselves as royalty, because they should know that they are important in their own way.",2015-01-20,2015
5.0,0001844423,I read this series to my children and bought this boxed set for my granddaughters.  This is a tremendous series.,2015-01-19,2015
4.0,0001844423,good,2015-01-19,2015
5.0,0001844423,beautiful set,2015-01-17,2015
5.0,0001844423,Great,2015-01-15,2015
4.0,0001844423,I liked it but it was much bigger in size than what I thought we'd ordered for my daughter. It is large and hardcover.,2015-01-14,2015
5.0,0001844423,excellent series. There was a reason that J R Tolkein was best friends with CS Lewis. Both amazing writers.,2015-01-10,2015
5.0,0001844423,"I read this book in under 3 hours, which I didn't expect at all, tho I read the others in a matter of days and weeks, but I didn't remember anything of it from my childhood, so I rushed thru it, but didn't expect to finish it in about 3 hours!!! The ending is sad yet happy as you realize they've all come full circle to Aslan's country but you know what that means in the end. Nevertheless, I think the ending will leave you smiling. Great book!",2015-01-06,2015
4.0,0001844423,"Purchased this book set for my 8 year old niece who is an avid book reader. I wanted to get her a set of books she could keep forever. I read this series years and years ago and loved it then. She was excited to get reading, as she was already familiar with ""The Lion, the Witch and the Wardrobe"" from seeing the play on a field trip in school. I wish the box that the books were in was more attractive, but that's just a personal taste thing I suppose. I'm not a fan of the art work. But it's about the stories inside, and those are great, so overall happy with the purchase!",2015-01-06,2015
5.0,0001844423,I didn't realize there was a prequel to the Chronicles of Narnia series.  I enjoyed reading how Narnia was founded!,2015-01-06,2015
5.0,0001844423,"My kids are 6 and 11.  There are mornings where the 6yo says excitedly to the 11yo ""Wanna go downstairs and listen to Narnia?"" and they both run excitedly to the stereo.

This particular version is not just an audible read, but dramatized--so it's fascinating for the kids.  And the holder is a work of art in and of itself.

My only regret is not waiting to use it on a 15-hour road trip!",2015-01-05,2015
5.0,0001844423,Exactly what I was looking for and delivery time was excellent!,2015-01-05,2015
5.0,0001844423,The children and I read this book together in the evening.  Written after the Chronicles of Narnia to explain how Narnia came into existence.  It is quick and light reading but very enjoyable.  Not as detailed as the Chronicles but as always addresses some difficult life issues and has positive outcome.,2015-01-04,2015
5.0,0001844423,Awesome book,2015-01-03,2015
5.0,0001844423,"This set was actually purchased as a christmas present  for my nephews half way across the country. I spoke with my brother when they arrived and he said my older nephew was actually picking them up to read, while my younger nephew looks interested but isn't quite reading chapter books yet. I consider it a good investment in their library and collection. It arrived in good time, before the date, and in good condition (this was actually purchased not during the holiday season but before it.) I was very happy, thank you",2015-01-03,2015
5.0,0001844423,"Great, as are all the stories in the Chronicles of Narnia..",2015-01-02,2015
5.0,000215725X,This an outstanding book that explores both modern and historic Delhi.  Dalrymaple does a brilliant job of taking a personal narrative and using to to insightfully investigate Delhi and sifts through the layers of culture that build the city and shaped it.  I read it prior to my first vacation to India and loved it.  I strongly recommend it for those who are interested in India or Delhi.,2015-12-02,2015
5.0,000215725X,Great read!,2015-10-30,2015
5.0,000215725X,"A most interesting story of a Scottish writer in the India of the 1980's.
An insight into the post - independence atmosphere in India and its present
society.",2015-10-29,2015
5.0,000215725X,Dalrymple is one of my favorite authors. The book is well researched and moves quickly. He captures the essence of Indian life as it speeds through history to the present in Delhi and its environs.,2015-09-25,2015
4.0,000215725X,"I read this book while traveling to Delhi and it was a wonderful read. It was short and light, but did a great job of weaving the past and present in a story in about the same way that Delhi itself blends past and present. I'd recommend for anyone from the West travelling to Delhi for the first time!",2015-06-02,2015
5.0,000215725X,"Another important read on New Delhi, India.  Arrived in good condition, and a swift delivery. Thank you",2015-03-04,2015
5.0,000215725X,took me back to all the monuments I saw in Delhi. no longer just a building but now I got story along with it.,2015-03-03,2015
2.0,000215725X,"This is more a history book than a portait of contemporary Delhi.  William and Olivia, his mate, quickly become dull.  The interesting characters mentiond in the synopsis are never fleshed out.  Most are introduced by way of very brief interviews.  I expected more than a very superficial rendition of what are probably fascinating people and an complex city.",2015-01-27,2015
5.0,000215725X,"After a visit to Delhi, I read this book and greatly enjoyed it -- it added to my visit considerably.",2015-01-22,2015
4.0,000215725X,"This is a wonderful ""documentary"" book. So well written with humour and insight about the history of Delhi. The author's clearly extensive research has certainly paid off in a fascinating account covering a wide range of aspects. My only criticism is that I found it too long. I, too,began to feel a bit jaded at the end of the sweltering Dehi summer!",2015-01-05,2015
5.0,0002005549,can't beat the Michael,2015-12-22,2015
5.0,0002005549,Excellent book that arrive in great condition. A+,2015-12-05,2015
5.0,0002005549,"Friends:

I looked up the programming languages that control the swarms of nano robots that are mentioned in this book and these languages do exist and we can use them on our projects.

We live on a 1640 acre Ranch in the remote Sangre de Cristo mountain range of Colorado.  Swarms of nano robots could be used to control noxious weeds in our pastures as long as they don't choose humans as their Prey.

Google my name to Learn more.....

Arthur von Boennighausen",2015-11-26,2015
1.0,0002005549,formulaic--a lot of boring detail,2015-11-16,2015
4.0,0002005549,This book was  not the typical type of story I normally read but I found myself not able to put the book down. I had to know what would happen next.,2015-11-12,2015
3.0,0002005549,I doubt that Michel Crechton wrote this book.  It is not of his quality.,2015-11-10,2015
5.0,0002005549,"Read this book and then look up what NASA is doing with tiny satellites---really thought provoking.  I read this and enjoyed it but thought it very improbable until I found we are doing a similar technology with small ""cube"" satellites that communicate with each other to convey more information.  These are not as sophisticated as the scenario in the book but a first step???",2015-11-09,2015
5.0,0002005549,Once again Michael bats it out of the park! This was a great ride and scary because this could actually happen !,2015-11-06,2015
5.0,0002005549,An excellent suspenseful tale from start to finish.  You won't want to stop reading.,2015-11-03,2015
4.0,0002005549,Once I got into the idea I had a hard time putting the book down. On to the next story.,2015-11-03,2015
5.0,0002005549,"This is a fast paced story--- scary to think that mankind uses technology and changes nature more and more without really knowing the consequences, and a story like this could be a possibility.",2015-11-02,2015
4.0,0002005549,"Really suspenseful with the steady character formation and build to the action that he does so well, I couldn't stop reading even thou8gh I was petrified!",2015-10-24,2015
5.0,0002005549,Great book,2015-10-17,2015
4.0,0002005549,Thriller,2015-10-08,2015
5.0,0002005549,"Crichton always tells a good story. One can get bogged down in the technical background but if you're familiar with thinking about nanobots, AI and corporate greed then you'll feel right at home. Interesting with relevance to our near future and as always with the good always comes the bad.",2015-09-27,2015
5.0,0002005549,Very exciting. I couldn't put it down.,2015-09-02,2015
1.0,0002005549,"I felt I was trudging through mud way before I got near the end. The whole book seemed to drag, but I hung in there because i've always liked Crichton's books in the past. Maybe the science and technology was just too unbelievable and seemingly illogical for my brain, but I'm sorry to say I found reading this book to be boring and tedious. The ending didn't make up for the slow pace throughout.",2015-08-31,2015
4.0,0002005549,"Very interesting, well written",2015-08-27,2015
2.0,0002005549,a so so tedious read,2015-08-27,2015
3.0,0002005549,"I really enjoyed the start of the story and think the topic of the book is incredibly important.  However, the last quarter of the book is a real let-down as Crichton went way overboard in the possibilities he envisioned and what could have been an immensely important novel comes crashing down in never-never land.",2015-08-22,2015
5.0,0002005549,Excellent couldn't put it down,2015-08-22,2015
5.0,0002005549,Great story and worth the read. Makes you stop and think about what scientist might be working on in secret labs.,2015-08-20,2015
5.0,0002005549,"Gripping tale of adventure and suspense, a page turner. My husband saw only the top of my head for hours with an occasional Mmmm as response to his comments as I could not put it down. For those who love good writing- Enjoy.",2015-08-20,2015
4.0,0002005549,Good read.,2015-08-18,2015
5.0,0002005549,"Again, this author gives you a great mystery!  The characters are great.  The storyline holds your attention and again, you have a problem putting the book down!  Loved it",2015-08-15,2015
4.0,0002005549,Real science fiction. Well researched fun and suspense.,2015-08-06,2015
4.0,0002005549,The story was great and the writer kept it moving very well.  I just was not that interested in the science behind the story so those sections were a bit boring to me which is why 4 instead of 5 stars.,2015-08-06,2015
4.0,0002005549,"TThis was written over ten years ago but it has the feel of today.

A computer programmer is out of work and keeping house while his wife, an up and coming computer specialist, works. When she starts behaving strangely, he suspects she's having an affair. Worse, he fears she's beginning to document things he says and does in preparation for an 'alienation of affection' suit that will take his children away from him during a divorce.

Then he's offered a contract job for the company she works for. It seems her company bought his program from the company that fired him. They are experiencing problems with it and want him to fix it.

He's afraid he'll be the fall guy -- again -- if the kinks can't be worked out and is hesitant. Then his wife has an accident and things go screwy. It seems the only way he can find out what's going on is to take the contract work.

From then on, it's a nail biter.

I'm not a scientific person, so I don't know about the IT part of this. But it kept me hooked till the last page.

Good read!",2015-08-01,2015
4.0,0002005549,"Not one of his best, but, still pretty good. I would have saved the wife as an ending. Worth $.99 though.",2015-07-24,2015
5.0,0002005549,"A typical Crichton novel, which is to say that this book is a very satisfying work of literature.",2015-07-17,2015
3.0,0002005549,Lots of tech talk...not enough personal interaction.  The entire book was dedicated to solving one problem without enough character development.  How did the male lead go from wimpy Mr Mom to bad ass swarm killer ?  An ok read but wasn't all that scary,2015-07-13,2015
4.0,0002005549,"For those of us who like something different and imaginative to read, Crichton always seems to fill the bill.  This book was no exception.  It gets into some techno/scientific subject matter here and there, but not to the point where I felt like skipping pages, and I think it was necessary for the story - so we could have just a little understanding of how the premise of the story might be possible.  It left me wishing for more from Michael Crichton.",2015-07-10,2015
5.0,0002005549,"I've read four of Crichton's books so far - Micro, Congo, Jurassic Park, and Prey. Prey is easily the best of those. The central character is instantly relatable, and extremely likable. The backstory is well set, and the story flows beautifully. And when you finally get to the swarm, the book gets insanely good. In fact, it's the only of his books that doesn't feel like there are any extraneous events; everything is necessary. The plot only ever picks up speed until it's riveting finale, and the research by Crichton is so good I'm afraid it could be accomplished in real life by some rogue company! If you haven't, read this NOW.",2015-07-09,2015
5.0,0002005549,Loved it from begining to end.....,2015-07-04,2015
4.0,0002005549,Captivating. Will hold your interest all the way to the  end! A very good summer read that is fast moving.,2015-07-01,2015
5.0,0002005549,"Is there anything written by Crichton that is not excellent ? This is a fabulous story with deep characters easy to relate too.
Always some aspect of knowledge base I'm not familiar with which I think is what makes his novels so appealing. Well worth your time.",2015-06-22,2015
3.0,0002005549,FRIGHTENING POSSIBILITIES OF THE MERGER OF NANO-SCIENCE AND HUMAN NATURE.,2015-06-16,2015
