overall,asin,reviewText,time,year
2.0,0002005018,"This book was depressing. I felt sorry for Clara at first, then couldn't take her repeated bad choices. I finally just saw it going from bad to worse and stopped reading it. Maybe I would have been pleasantly surprised at the end, but from where I saw it leading, I doubt it.",2015-05-31,2015
4.0,0002005018,"Easy flowing, quite well written. Characters interestingly described!",2015-05-30,2015
4.0,0002005018,This was a different read for me but I really enjoyed it.  I read it sometime ago so I don't remember all the specific details.,2015-05-30,2015
4.0,0002005018,"The story concerns two sisters from a small town in Canada, who travel different paths.  One leaves for NYC and becomes a  successful radio actress, while the other, a school teacher,  remains behind.  I enjoyed the author's use of correspondence as a vehicle for telling the story.  I thought the writing was fluid,  the time period well researched and the story enjoyable.",2015-05-16,2015
4.0,0002005018,"The story of two sisters is told completely through their letters and Clara's diary entries. Nora leaves the small Canadian town to live in New York and lands a job as a radio soap opera actress in the 1930's. Clara remains in the small town teaching at the school where her father was principal before his death. Clara finds a radio, phone and car unnecessary. After an incident on the back roads of the small town, Clara seeks out the help of Nora in New York. After returning to Canada, Clara occasionally treats herself to a movie in a larger city. It is there that she meets a man that changes her future.

At first I felt sorry for Clara and was sure that ditzy Nora was headed for big trouble. Although Nora had her share of man troubles, it was nothing compared to the troubles of her spinster sister, Clara. I kept hoping Clara would soften or wizen but the afterward leads the reader to believe that did not happen.",2015-05-14,2015
5.0,0002005018,"What a delight to read this subtle, beautifully and deceptively simply written book. Nothing happens and then everything happens, back and forth.  Clara is a marvelous character, well-drawn and well-liked, despite her strange and quirky personality.  She is a gift to the reader, so DO read the book.",2015-05-12,2015
4.0,0002005018,"Easy to read, set in the depression in small town in Canada and also in New York City.  Interesting.",2015-04-22,2015
5.0,0002005018,Well written with very interesting characters.,2015-04-19,2015
5.0,0002005018,"I got this book as a bargain kindle.  I thoroughly enjoyed it.  Wonderful characterizations.  Location is mainly Canada & NYC.  I found the Canadian descriptions especially interesting. If you give it a try, you will be so glad that you did.",2015-04-19,2015
4.0,0002005018,"I thoroughly enjoyed this novel.  It is an easy and entertaining read about the lives of two sisters, set in the 1930's, in Canada and New York City.  Mr. Wright choose journal entries and letters to and from the characters to formulate the story, which worked very well, in my opinion. I am now interested in other books by this author!",2015-04-17,2015
5.0,0002005018,I loved reading this book.  His way of keeping a story so strong by useing written letters was great. I would recommend this book to all and especially Book Club members,2015-04-17,2015
4.0,0002005018,Very good story with a bit of violence that threw me for a loop. A very plain school teacher that has a charming sister .The charmed sister becomes successful. The school teacher has a mundane life and is struck by a violent act. Later the teacher falls for a DonJuan that has a horrible effect on her life...Great book...great story...holds your interest till the very end.,2015-04-12,2015
5.0,0002005018,"This story will not appeal to just anyone, for me it has been a journey of retrospection. I plan to read it again once I have recovered from reading it now.",2015-04-09,2015
5.0,0002005018,"I really enjoyed this story of two sisters from a small town in Ontario, told through a combination of their correspondence and Clara's diary. The story takes place mainly in the 1930s and is a good reflection of the challenges faced by single women during that time. One sister goes to New York and becomes a popular radio soap opera star, while the other remains a schoolteacher in her small town in Canada.

The story reads as though it was written by a woman, but surprisingly, the author is a man, who did a commendable job of conveying the lives of these two very different women.",2015-04-04,2015
2.0,0002005018,"This was a dark and dreary story.  I had to stop reading now and then, and in fact I skipped a lot of it.  Just depressing",2015-04-03,2015
5.0,0002005018,Well written account of a life experienced by a unmarried Canadian woman in the 1930's.  The diary format and internal insights gave a reader a clear picture of the main character and her struggles.,2015-04-03,2015
5.0,0002005018,Engrossing and well done novel about the dreams and foibles of women.,2015-03-30,2015
5.0,0002005018,"What a wonderful story, I was engrossed in the lives of Clara and Nora from the start.  So well written.",2015-03-29,2015
4.0,0002005018,Very interesting and a page turner.  It ended so quickly and wish that there had been more substance to the daughters life growing up. Devoting only one chapter to her life was disappointing.,2015-01-24,2015
5.0,0001473123,Great reference material,2015-11-19,2015
5.0,0001473123,outstanding charts and information.  a must have!,2015-11-16,2015
5.0,0001473123,a clear and consice understanding of the second coming of Christ and a simple guide to seeing the events in order of their happing.,2015-09-11,2015
5.0,0001473123,Great book,2015-05-21,2015
5.0,0001473123,Great book,2015-05-04,2015
5.0,0001473123,"Written in the early 20th century (1915), this book is very relevant today.  Dr. Larkin was able, through the leadership of the Holy Spirit, to interpret very complicated prophecy and explain it for simple minds to understand.",2015-04-06,2015
5.0,0002163578,"Even though the Owens' studies in the Kalahari ended in 1980, this book remains a classic of African conservation. Beautifully written, it inspired us to go to Botswana to see and hear and smell for ourselves this truly incredible place. The book is eloquent testimony to the necessity to preserve wild places.",2015-12-22,2015
5.0,0002163578,This is an extraordinary  book. I could not abandon it just as Mark and Delia could not abandon their cause no matter the difficulties. I am accustomed to reading murder mysteries and historical novels but this book had everything with the added bonus that it really happened. I feel so much more attuned to desert animal behavior and have come to appreciate hyenas as much as lions. I am leaving for Botswana soon and hope to see what if any impact they had on the plight of these wild animals.,2015-09-25,2015
5.0,0002163578,"So exciting.  I felt like I was there with the author, and learned a lot too.  Well written.",2015-08-27,2015
1.0,0002163578,I thought the book was poorly written. There were many typos that should have been edited.,2015-08-15,2015
5.0,0002163578,very good,2015-05-12,2015
5.0,0002163578,Loved it. Beautifully written on what is obviously one of the inhospitable places on the earth.  Very interesting story on topics we would never see on the evening news.  Buy it! It's good!,2015-03-24,2015
5.0,0002163578,"From laughter to shock to tears, this book will make you want to go on safari and then to contribute to the conservation of the remaining African wildernesses.",2015-02-26,2015
5.0,0002163578,"after living in Botswana as a Peace Corps volunteer, I loved the book and wish I was back there...and that the book would never end",2015-02-21,2015
5.0,0002163578,"An  incredible story of dedication and risk for the love of your dreams. Before GPS, cell phones and so much other high tech gadgetry, these two science and animal lovers roughed it to find their destination and task into the wild. Much information was derived from their efforts, as they  monitored and  recorded the behaviors of these majestic predators and the fragile habitat they reside. I was astonished to learn of many behaviors that were contrary to one had known  at  the time. These wildlife  biologists are  the ilk that had went out  to save  the wild lands, and hopefully their efforts have.",2015-01-09,2015
2.0,0002163578,Its ok,2015-01-01,2015
4.0,0002005379,awesome,2015-12-20,2015
5.0,0002005379,"A very different read from what I'm used to, but exciting, none the less. I hope to read more by this author. Very clear and crisp writing. Amazing descriptions of scenes.",2015-12-16,2015
5.0,0002005379,REEEEAAADDD,2015-12-08,2015
5.0,0002005379,"I read this book for Battle of the Books in high school and loved it so much I decided to read it again. It's a great read for adolescent's and a fun easy read for adults. I read it before I even knew what steampunk was, and will likely look for more books like it!",2015-12-05,2015
5.0,0002005379,"I do Not know, it was a present to my grand daugther",2015-11-07,2015
4.0,0002005379,"The Airship Aurora isn't the only thing here that's lighter than air, but that's O.K.

This feels like a middle grade, early YA adventure. With the airship and the alternate technology it is steampunk, but that aspect isn't heavily featured and the tech frames and informs the story but doesn't dominate it. In a similar vein, there's swashbuckling adventure that makes this a direct descendant of high seas pirate adventures, but again that's mostly for flavor and atmosphere.

Our two primary characters, mild and modest but daring and stalwart Matt, and sassy, spirited Kate, carry the burden of the story effortlessly. Matt is an engaging narrator. Kate is a worthy and equal companion in adventure. Neither is loaded with quirks and while they aren't developed deeply they are fleshed out as completely as necessary for this type of adventure.

This is a modest, well crafted, imaginative, good-hearted, good-humored adventure. It's crisp, clear, fast paced and briskly plotted. It doesn't always go for big effects, and its appeal to me was built up from a number of small observations, events, descriptions, bits of dialogue and characters. That's what made it seem especially appealing for newer and younger readers testing the water for this type of fiction. As such, it struck me as a fine and entertaining introduction to the genre.",2015-09-14,2015
5.0,0002005379,I hardly remember buying this--I must have got it through a goodreads sale or something--but it's super cute and neatly written. Definitely worth it.,2015-06-03,2015
5.0,0002005379,Wonderful storyline and very entertaining. The novel moves at a good pace and leads to a creditable conclusions. I am ordering the 2nd one in this series.,2015-05-23,2015
4.0,0002005379,"The good: apart from a couple of homonym errors (breech/breach, broach/brooch) and a few minor typos, this is well-edited and reads smoothly. It's exciting and full of varied adventures.

The bad: the plot relies heavily on coincidence, culminating in a deus ex machina. Also challenging the suspension of disbelief are some conspicuous science fails.

OK, I was willing to bracket the gas that's lighter than hydrogen, completely inert, and smells of mangoes, and set it aside in the name of enjoying the story, even though that makes no sense in chemistry, physics or biology. But there's no way that you could trap enough of it in a pair of (untreated) silk harem pants to lift two teenagers, who have to weigh at least 200 pounds between them, probably more. This would be true even if they weren't rising through <i>more of the same gas</i>, which reveals that the author has no clue about physics whatsoever.

The coincidences, though, are much harder on the suspension of disbelief.

<spoiler>The main character happens to rescue a man who's passing in a balloon. The man's granddaughter happens to be a passenger on the same ship a year later. (OK, maybe she deliberately went on the ship that rescued her grandfather, though I don't recall that being mentioned). The ship happens to be attacked by pirates, who happen to cause it to crash, though it happens to make it to an uncharted island a thousand miles from anywhere else, where the grandfather had seen strange creatures and written about them in his journal. This happens to be the pirates' base, and by this point I am over-coincidenced. But wait! here's more! The strange creatures turn up again, just in time to rescue Our Hero from the pirate leader, almost like some kind of god being let down out of a machine.</spoiler>

It's a tribute to the storytelling that I still enjoyed this, despite these serious issues. I don't think I will read the sequel, though.",2015-05-17,2015
4.0,0002005379,Fun easy story. I read it as an adult and enjoyed the adventure and twists- unfortunately my 14 year old was less impressed.,2015-03-29,2015
5.0,0002005379,"It is deeply satisfying to not only read a well-crafted story with wonderfully engaging characters, an adventurous plot, and beautifully rendered setting; but to read a story so well written that the English language is once again a tool of beauty-- now that is a pleasurable experience I've sorely missed over the years.  I highly recommend this book for all readers whose age is in the double digits!  I'd give this book more than five stars if I could!  This is one to keep on the shelf with other great classic adventure stories.",2015-03-02,2015
5.0,0002005379,excellent,2015-02-19,2015
5.0,0002005379,"I really enjoyed reading this book. Great story and a great story teller. If you enjoy Cussler, Dietrich or Turtledove, you'll like mr. Oppel's tales.",2015-02-17,2015
5.0,0002005379,Loved the book. Gave it to my 9 year old grandson and he loved it. Fun to be 75 and still love fantasy adventure.,2015-01-31,2015
5.0,0002005379,"Fantastic!!  Wonderful read, very interesting details about air ships.  It grabs you and takes you on a thrilling journey!!
I was sorry to have it end, although the ending was great!!
SAK",2015-01-30,2015
4.0,0002005379,"The book was fun to read.  Fast-paced and very enjoyable.  I recommend it to anyone wanting a fun experience.

 S j",2015-01-02,2015
5.0,0002005379,Coming of age novel. Victorian steam punk. Breakdown of economic and social boundaries under pressure. I loved this book. I read that it would be great for middle school boys. I am a 60 year old Latin teacher!!  Ingenuity and faith allow our heroes to win. Good escapism for anyone.,2015-01-02,2015
5.0,0001839233,"Gorgeous, intricate illustrations of mouse life.",2015-10-10,2015
5.0,0001839233,Cute story. Book was in great condition! No issues with seller at all!,2015-10-06,2015
5.0,0001839233,"The books in this series are among our children's favorites, as well as mine.  We have several sets.",2015-09-09,2015
5.0,0001839233,Jill Barklem is the ultimate in story telling and illustration.  Winter Story follows the tiny inhabitants of Brambly Hedge through preparing for a snowing winter and culminating with merriment at a very festive and food filled snow celebration.,2015-05-01,2015
5.0,0001839233,Our copy of Summer Story and Jill Barklem's other Brambly Hedge books will never our home.  I never tired of studying the detail of her illustrations and reading the stories to my grandchildren who are delighted with the mice characters.  These books are the best of the best in children's books.,2015-05-01,2015
5.0,0001839233,Beautifully illustrated stories that are great reads for children.  They still inspire my imagination as a mama who reads with her children.,2015-03-25,2015
5.0,0001839233,"Bought these for grandkids - my daughter has the whole collection from the 80's,and I wanted to have the other grandkids know this magical world.",2015-02-09,2015
5.0,0001857290,"I've been looking for this series for a long time. I enjoyed it as a child, and even more so as an adult. Great author, awesome series, wonderful book, fantastic adventures, and much more. One of my favorites.",2015-08-21,2015
5.0,0001857290,"I can't believe I waited so long to read Diana Wynne Jones. She is amazing, and the Crestomanci series has been a joy to me so far.  I started here, with Charmed Life, and I have shot through the sequels with increasing delight.

Eric ""Cat"" Chant believes himself to be useless in the field of magic, unlike his brilliantly gifted older sister. When the children are orphaned, they are taken in by the mysterious figure of Chrestomanci, and taken to live in his strange castle, where odd dangers seem to lurk around every corner, and Cat finds it increasingly more difficult to understand what's happening, especially when his sister disappears and is replaced by an exact duplicate!

Is the strange, lofty figure of Chrestomanci friend, or foe?",2015-04-12,2015
5.0,000171287X,"My kids - especially my older daughter - loved, loved, loved this book. It's fast, repetitive, and fun. I had to buy a replacement for my grandchildren, because my own kids wore the original out.",2015-12-11,2015
5.0,000171287X,OUr beginning reader loves this book!,2015-12-01,2015
5.0,000171287X,"I bought this book for a ""Send your favorite"" baby shower.  When my sons (38 and 40) heard what I had ordered, they immediately began reciting from the book!  I knew then that I had made the RIGHT choice.",2015-07-08,2015
1.0,000171287X,The book was tattered and torn with pages that had been taped long ago. Not at all happy with it!!,2015-02-01,2015
4.0,0001844423,"This is a great set of books. C S Lewis doesn't not often disappoint, but I love this series. It's a great read if you like any sort of adventure and is great for kids and adults alike. This box set is nicely done, pretty box, and 7 softback books inside. In the particular set I recieved one of the books did not perfectly match the other 6, maybe it was a slightly older printing,  but doesn't affect the overall quality.",2015-12-30,2015
5.0,0001844423,Great stories.,2015-12-26,2015
5.0,0001844423,Good book,2015-12-23,2015
3.0,0001844423,"After she is tricked by Digorys uncle into touching a yellow ring, Polly disappears. Digory has no choice but to follow with a different ring, one that will bring her back. The kids end up in a dead land where Digory awakens an evil witch/queen. Later, Polly, Digory, Uncle Andrew, the witch, a horse, and a cabby end up in a completely dark land. Soon Aslan the Lion appears and wakes the magical world called Narnia with his song.

The Magicians Nephew tells the story of Professor Kirke as a child (Digory) and the beginning of Narnia. It was slightly interesting, but mostly a lot of words and not much actual action. It was just okay.",2015-12-22,2015
5.0,0001844423,"I love this book, and the illustrations are beautiful!!",2015-12-18,2015
3.0,0001844423,"Love this series, but I didn't realize the hardcover is a single book, I'm hoping to return it for the actual 7-book series.",2015-12-16,2015
5.0,0001844423,"CS Lewis is my favorite author of all time, and these are a classic addition to any book-case collection.. Great gift for kids to introduce them to his works. Great price. Good condition. Older edition of the print and book cover, but still nice.",2015-12-14,2015
5.0,0001844423,I am happy with the quality of this edition of these classic books.,2015-12-12,2015
5.0,0001844423,LOVE,2015-12-12,2015
5.0,0001844423,I had to hunt this down to add to my Barnes & Nobles Classic collection.,2015-12-07,2015
5.0,0001844423,"Beware of the difference between the hardcover and softcover of this edition: the hardcover is a single volume, and the softcover is a boxed set!

But, with that out of the way, these books are some of the most delightful and thought-provoking stories you will ever encounter. I fell in love with them as a child, and still consider them among my favorite works of fictionnow I get to introduce a new generation of young readers to them, who I hope will enjoy them as much as I did at their age!  C.S. Lewis is truly a master storyteller who incorporates important observations of human nature and lessons of morality and faith into a world of magic and endless possibilities.",2015-12-06,2015
5.0,0001844423,Came as advertised.,2015-12-06,2015
3.0,0001844423,It was pretty good it took me awhile to get into it.,2015-12-03,2015
5.0,0001844423,Incredible dramatic reading!! My kids beg to listen to it!!!,2015-12-02,2015
5.0,0001844423,"good, used set.......no scratches.  GOODWILL has always sent good products to me",2015-12-02,2015
5.0,0001844423,"The books are obviously classics and are already so amazing but the narrators on these CDs are fantastic to listen to. My husband and I, along with all three of our kids (ages 12, 10, and 7) love listening to these on our car trips.",2015-12-01,2015
1.0,0001844423,"I'd give it a thousand stars if the publisher hadn't persisted in the unforgivable error of placing The Magician's Nephew in front of the other books, where IT DOESN'T BELONG. The book was written as a PREQUEL. Prequels are supposed to be read/viewed AFTER the materials they precede in the fictional chronology. The version I received has a different cover and the medallion on front says it's for the 100th anniversary, no the 50th, as pictured. Perhaps after I return this I'll be able to locate the 50th anniversary edition, where I hope they hadn't yet figured out how to mess with a perfectly good thing. Seriously, this whole re-ordering business was a plot by the White Witch. Aside from this one fatal flaw, the book itself is masterfully done. Full color pictures - the ones done by the original illustrator, and an elegant two-column layout for the text, with a ribbon for bookmarking. If anyone out there can stomach living with a disordered series then this is the book for you.",2015-12-01,2015
5.0,0001844423,"These are such wonderful stories. My husband is reading them to our 5-year-old daughter and she loves them. Some books read more easily than others, and attract her attention more, but she's enjoying them so much.",2015-11-30,2015
5.0,0001844423,Beautiful! I have always wanted this - my only kvetch is that they have the new order (Magician's Nephew is #1). :(,2015-11-26,2015
5.0,0001844423,My kids love to listen to this on road trips or during rest time. It has been fun to share a childhood favorite with them. Wonderful listening for all ages.,2015-11-24,2015
5.0,0001844423,A classic,2015-11-22,2015
5.0,0001844423,"We read this book to prepare for discussion in our Bible class.  We were delighted to discover how  the allegories related to spiritual and Biblical stories.  I liked being able to read the tales of Narnia from the beginning.  It helps to fit the pieces together.  Also, C. S. Lewis' writes beautifully so his books are a joy to read.",2015-11-22,2015
5.0,0001844423,Love it,2015-11-18,2015
5.0,0001844423,What's to say?  It's the Chronicles of Narnia!  I've been reading them with my 7 YR old Granddaughter and now she has her own set and is rereading each one on her own.  She loves them and I love them Such a joy to introduce her to them.  They are equally as delightful today as they were when they were written in the '40s.  C.S. Lewis's wrote amazing stuff with many layers to be explored no matter how old one is!,2015-11-17,2015
5.0,0001844423,"We love Narnia, and this is put together so nicely with the tin.",2015-11-17,2015
5.0,0001844423,Love the Narnia books,2015-11-17,2015
5.0,0001844423,Love the Narnia books,2015-11-17,2015
5.0,0001844423,perfect for 5-6 graders,2015-11-16,2015
4.0,0001844423,Every book is connected but different.,2015-11-16,2015
5.0,0001844423,still engaged with the Chronicles. Love them and counting for the Silver Chair.,2015-11-16,2015
1.0,0001844423,"Lewis's writing is wonderful, but the digital edition is awful. I purchased this for research purposes, but it's useless as it's one long string of unsearchable content. It took me at least 20 minutes to find the start of one specific book in the set.",2015-11-14,2015
5.0,0001844423,it's C.S. Lewis...enough said,2015-11-12,2015
5.0,0001844423,Everyone should read this series. I love how Lewis weaves God's awesome power into the story and his caring nature.,2015-11-09,2015
5.0,0001844423,"This book is enormous, a plus for the amount of money spent as well as for reading convenience. It is NOT text only- it is fully illustrated in color. Mine shipped from the UK so it took a little longer to get to me (in Nebraska) and it got a little beat up on the voyage, but it was in pretty good condition nonetheless.",2015-11-09,2015
5.0,0001844423,This was the first time I have read VDT and it was one of my favorite Narnia books so far! I grew up watching the BBC versions and they don't do the book justice. Although the BBC version is much better than the Film that came out in 2010. I would say this book is a must read for any Lewis fan.,2015-11-09,2015
4.0,0001844423,Good book in the series,2015-11-07,2015
5.0,0001844423,It's by C.S Lewis.......... what more do you need to know?,2015-11-07,2015
4.0,0001844423,My daughter enjoyed reading it.,2015-11-06,2015
4.0,0001844423,My daughter enjoyed reading it.,2015-11-06,2015
5.0,0001844423,Great little book set.,2015-11-03,2015
5.0,0001844423,I love the Chronicles of Narnia series. They never get old and are a pleasure to read. Very highly recommended reading.,2015-11-02,2015
5.0,0001844423,I believe C S Lewis is one of the great authors of his time and that his books The Chronicles of Narnia were a true pleasure to read. So far i read them only once but for weeks afterword Narnia was constantly on my mind. I Just think it's too bad it ended when it did because it would be awesome if there could be even 30 narnia books.,2015-11-01,2015
5.0,0001844423,ok,2015-10-31,2015
5.0,0001844423,ok,2015-10-31,2015
