overall,asin,reviewText,time,year
1.0,0002051850,"I imagine that the reputation of this book as a classic has others afraid to admit that it is truly terrible.

The book has a few, fleeting moments of absolute genius (El Sordo's fight, Pablo's first uprising, etc.), but overall the book is horribly boring and completely unrealistic, at least to any American who has perhaps never experienced early 20th century Spanish culture.

This entire book is basically a love story between main character, Robert Jordan, and Maria, set against the Spanish Civil War. What makes this so unrealistic is that the book takes place entirely over only three days, and at the beginning of the book Jordan and Maria have not yet met. So, in the course of just THREE DAYS, we are expected to believe that they go from complete strangers to in love in a way that defies comprehension. Not only is this unrealistic, but it is also SO BORING. There are literally entire chapters of just Robert Jordan and Maria telling each other how much they love each other.

This book is described as a war novel, but its only a war novel in the sense that it takes place during the war. There is very little actual war that happens in this book.

Basically, the book is boring. It was a struggle to get through, and I only finished it because my OCD forces me to finish books I have started. But I hated it.",2016-06-10,2016
5.0,0002051850,Awesome,2016-05-24,2016
4.0,0002051850,A classic!,2016-05-24,2016
4.0,0002051850,A great read.,2016-05-23,2016
5.0,0002051850,Thanks.  Great book,2016-05-18,2016
3.0,0002051850,I may have it in college. Or tried to. It's a good tale with salient history and philisophy. But it is too long in light years and the writing is below average. I agree with those who argue Hemingway was not a great writer but perhaps a good story teller with an unusual narrative that gets very tiresome.,2016-05-16,2016
5.0,0002051850,"It's wonderful to return occasionally to the books that have stood the test of time.  Like Faulkner and Fitzgerald, Hemingway still knows exactly what words to use and what story to tell.",2016-05-11,2016
5.0,0002051850,"Great book, i recommend for everyone.",2016-04-29,2016
5.0,0002051850,"Its astonishing how many people, when one mentions For Whom the Bell Tolls, automatically say, Oh I read that. It is almost always a reading that happened many decades ago, perhaps in school, and many people recall only the love story, the earth moved interludes likely to impress a young person. This certainly describes me. It was on my familys bookshelf.

However, because I was reading Adam Hochschilds recent history of American participation in the Spanish Civil War (Spain in Their Hearts), I wanted to read the novel again. I am glad that I did, these many years later.

As a younger person, I am sure that I did not appreciate how the novel conveys the moral complexity of war. There is not only the Republican guerilla Anselmo, an old man who weeps when he must kill the enemy sentry, but the Nationalist lieutenant Berrendo, who must order the beheading of the dead El Sordo and his men, but cannot watch it. I am certain that I did not appreciate the character of Pilar, the powerful woman who dominates the band of men that Robert Jordan joins in order to carry out his assigned bridge detonation. Her description how her husband and his allies murder a towns Fascist officials is unforgettable. And Jordan himself is a far more complicated figure than I recalled. The life he lives in the few days he spends in the mountains is (perhaps) more full and more worthy than the life he might have had as a professor of Spanish back in Montana. He sees, hears, and feels everything in a state of intense hyper-alertness. However, there is nothing sentimental in this novel, no glorification of war or machismo, just a sense of lives lived for a just cause, teetering on the edge of eternity.

And then there are the planes, the mechanized and distant form of warfare feared and hated by the partisans. The impersonal bombs that rain down from on high are the future.

M. Feldman",2016-04-05,2016
1.0,0002051850,I am not sure why I finished this book other then to say I have read a Hemingway. I have had root cannels that were less painful.,2016-03-20,2016
5.0,0002051850,"Have you ever read any Hemingway before? Did you come to this title because (a) it is one of his best known works (b) you think you know a bit about Hemingway and therefore (c) there will be lots of blood,guts, heroics and manly goings-on? I thought this might be a good introduction to Hemingway - a good adventure story with lots of action and heroism - a story i could enjoy in case I did not like the prose.

Well, prepare to be delighted. The book contains all the things in the headline of this review and is absolutely not an action adventure story. It is a ""true"" story about the nature of war and how people affect it and are affected by it. What Mr Hemingway taught me is that he is a writer foremost and everything else after. He reminds us that he has been in actual war and that it affects very normal everyday people in generally awful ways. For them (us) there is no happy ending.

If, like me, you have put off reading Hemingway because his novels were set decades ago, please put aside your apprehension and pick up this (or any other) book by him.",2016-03-18,2016
2.0,0002051850,tedious,2016-03-16,2016
2.0,0002051850,"I wanted to read it because it is a classic and i like historical novels.  However, it moves exceedingly slowly.  I was able to persevere through about 2/3rds of it but just could not finish it.  I wanted to get to the blowing up of the bridge but it is just too much of a waste of time.",2016-03-15,2016
5.0,0002051850,"Fantastic. I read this to get a better understanding of why Hemingway is seen as a great author. I will advise you to stick with the book. Like ""A Clockwork Orange"", at the beginning the text can be hard to work through. It is because Hemingway was capturing what it's like to speak a foreign language among native speakers. One of my favorite books that I read in 2015",2016-03-14,2016
3.0,0002051850,"I'm glad I read it, but it was rather slow going for me.  Lots of introspection by the main character.  It made me do some research on the Spanish Civil War.  Very interesting.",2016-03-10,2016
5.0,0002051850,Excellent,2016-03-07,2016
5.0,0002051850,Great piece of literature.,2016-03-01,2016
5.0,0002051850,I read this book 40 years ago. I appreciated it even more this time.,2016-02-20,2016
5.0,0002051850,Great book. Cant beat Hemingway,2016-02-18,2016
5.0,0002051850,"superb story so very well written.....passionate, sad, angry, suspensful.....a great book deserving of a read.",2016-02-18,2016
5.0,0002051850,"For me this was a re-read after a span of 40+ years. I was dumbfounded by my most recent impressions and narrative images. I've developed as a reader, certainly, but this time around I was captured by the drama, the characterizations, the depth of understanding of every aspect of the personal and political narrative. Plus, the subtle shift of language, Spanish to English and the distinction of the thinking and expression of the different characters. And the contemporary nature of terrorism and political applications to our 'world,' these ""Bells"" continue to toll for everyone. Not forgetting the drama, the timeline of several plot developments. I was captured. I was armed. And I was in love, too.",2016-02-16,2016
5.0,0002051850,Great read,2016-02-05,2016
5.0,0002051850,Love the book and the movie.,2016-02-03,2016
5.0,0002051850,Gifted & well received.,2016-02-02,2016
5.0,0002051850,you know what you're gettign with hemingway. never fails to deliver,2016-01-31,2016
5.0,0002051850,"Hemingway shows his masterful ability to express profound ideas through a narrative made up primarily of action and dialogue.  The reader follows a taut string, like the wire stretched by the dynamiter to the charge.  He hopes the wire will be long enough so he can stay clear of the explosion when it comes, but he can't escape it's awesome power.",2016-01-25,2016
2.0,0002051850,Slow & boring until the last 150 pages. Only stuck with it to say I'd read this classic book.,2016-01-24,2016
5.0,0002051850,"Ernest Hemingway's place in the history of literature grows by the decade. This work is timeless even if it is set in a civil war that took place during the 1930s.
Superbly written, this story is about ordinary people who took up arms during the Spanish Civil War. Only Hemingway could have told the story with such nuance, colour and passion.",2016-01-23,2016
3.0,0002051850,Some insights into developments before WWII.  Good drama among/between characters.,2016-01-21,2016
5.0,0002008599,"Easy to read.  A fun conversation between a ""reformed attorney"" and his protege.  It is a story that brings to bear ""7 Timeless Virtues of Enlightened Living.""

Overall I enjoyed it very much.  The virtues caused me to think about my own life and where I'm trying to go.  The ideas really aren't new if you follow Tony Robbins, Jim Rohn; however, Robin Sharma has done an excellent job presenting these ideas and virtues in a new way.

Personally, I think it is a worthwhile read for anyone who is trying to improve their lives and those around them.",2016-12-28,2016
5.0,0002008599,Deep but also easy to read. Conflicting right? The story itself is easy to follow how ever the thoughts it inspires are amazing. A strong recommend.,2016-11-29,2016
5.0,0002008599,It was an easy and enjoyable read that reinforces goal setting and positive actions bringing results.,2016-11-01,2016
5.0,0002008599,It is a book worth reading. It kept me interested from start to finish.,2016-09-27,2016
3.0,0002008599,"Interesting , but a bit extreme for me as a lawyer to read",2016-09-13,2016
5.0,0002008599,This was an excellent book. The way that sharma weaves this fable with actual  methods thay are invaluable is astounding. I didn't want to put it down!,2016-09-06,2016
2.0,0002008599,"Decent story, but it was nothing more than a fable. If I would have read more into the description I would have bought something else.",2016-09-01,2016
2.0,0002008599,"I had such high hopes for this book, but I was definitely disappointed.  It reads like The Celestine Prophecy, with hints of The Peaceful Warrior.  It's a good book, but the material could have been presented much better.  Maybe all of the ""enlightened"" authors write the same way, but I wasn't thrilled with this book.",2016-08-25,2016
2.0,0002008599,"The idea of an individual making a 180-degree change in his life caught my attention. I did not realize that this book is just a fable and a long-winded one at that. In the story, it is a high-powered lawyer struck down by a heart attack that sells the Ferrari and goes in search of enlightenment. He becomes a monk when he finds the people who can help him, and at that point, he no longer owns a car. The story is OK, I am just the wrong audience for it.",2016-08-17,2016
5.0,0002008599,What a book! Wow. Must read.,2016-08-14,2016
5.0,0002008599,It is more than I expected.  Love this so much.,2016-08-10,2016
5.0,0002008599,"Wow.  I have recommended this book to everyone.  I have read many books in this category, but for some reason this one just stood out.  I highlighted almost the whole book. A fable very well told and very easily adaptable to every day life.",2016-07-20,2016
5.0,0002008599,"Sharma had me at the title, and the rest of the book did not disappoint. He conveys that a successful life has nothing to do with the car you drive, and that money is not the answer to happiness. I agree with everything he says, except I still don't like to get up early in the morning!",2016-07-15,2016
5.0,0002008599,Great book,2016-06-19,2016
5.0,0002008599,"the best book ever.  Recommended over and over.  This is a book you can read once, twice, even a third time  and keep it as reference.",2016-06-07,2016
5.0,0002008599,for everyone this is a great book I bought additional copies for friends,2016-06-03,2016
5.0,0002008599,GREAT ITEM.,2016-05-09,2016
5.0,0002008599,"Great book, came highly recommended and didn't disappoint. Let's  you, at the very least, take stock of your life and greatly motivates you to be selfless",2016-04-22,2016
5.0,0002008599,"The book was very thoughtful and helpful in putting life in perspective.  I gained a lot from this book.  I tend to be high strung, so I could relate to the characters in the book.  I would highly recommend to folks with chaotic and stressful lives.",2016-04-01,2016
5.0,0002008599,"A beautiful tale having the message of living life to fullest. Instead of making a book with just self improvement ideas which could be boring to some , the story fashion of presenting really helped.",2016-03-12,2016
5.0,0002008599,This is one amazing book. Must read for everyone,2016-03-01,2016
3.0,0002008599,"The last time I read this book was in 2006 and for some reason the Taj Mahal story mentioned in the last chapter of the book stayed with me for all these years. And that was the reason why I chose to read it again this time.
I found the book to be inspirational and engaging and written in a very simple style which makes the book more readable. Though the book raises really good points (there are few gems in the book that I haven't seen anywhere), I found it to be unoriginal. I must say that I was surprised by how freely the author takes other peoples ideas without giving credit to them (Victor Frankl, Stephen Covey, Napoleon Hill to name a few). Clearly this shows that the author doesn't live the life of integrity he preaches. I would have given the book a four-star had it not been for this reason. But having said that I enjoyed reading the book and recommend to anyone who is looking for a quick and short inspirational read.",2016-02-17,2016
5.0,0002008599,"This is an amazing book! It shows how sometimes what we see on the outside may not always be true. This book is about the development of character and discipline in life. Robin Sharma, through this fable, is able to show us some very important things to keep in mind as we journey through life.",2016-02-09,2016
5.0,0002008599,A life changing book! I highly recommend it.,2016-02-09,2016
4.0,0002008599,Compilation of ideas from a variety of disciplines told in a story format.,2016-02-02,2016
5.0,0002008599,"<div id=""video-block-RX9LOBRRH2UK3"" class=""a-section a-spacing-small a-spacing-top-mini video-block""></div><input type=""hidden"" name="""" value=""https://images-na.ssl-images-amazon.com/images/I/F16Ga-LHDhS.mp4"" class=""video-url""><input type=""hidden"" name="""" value=""https://images-na.ssl-images-amazon.com/images/I/01WFCvaP7aS.png"" class=""video-slate-img-url"">&nbsp;From tonight onwards, take complete control of your life. Decide, once and for all, to be the master of your fate. Run your own race. Discover your calling and you will start to experience the ecstasy of an inspired life.

When you run inspiring, imaginative pictures through the movie screen of your mind, wonderful things start to happen in your life. Einstein said that imagination is more important than knowledge. You must spend some time every day, even if it is just a few minutes, in the practice of creative envisioning. See yourself as you want to be, whether this means serving as a great judge, a great father or a great citizen of your community.

~ Robin Sharma from The Monk Who Sold His Ferrari

Robin Sharma is one of the worlds top leadership expertsright up there with Jack Welch and Tom Peters. In fact, he was recently recognized as the #2 leadership guru in the world. He also happens to be a great author and a super cool guy.

When I was running Zaadz, our companies did some work together and I got a copy of his book, The Greatness Guide. AMAZING. I loved it so much I had autographed copies sent to everyone on our team immediately. Several months later Robin and I connected in Los Angeles. Our breakfast turned into me driving him to the airport to continue our chat and, after 4 or 5 loops around LAX buying some time before his flight, I finally had to send him off with an OMG! I just met a soul-brother! hug. (Love it when that happens! :)

It's a fun, quick-reading fable that lives up to its subtitle of being about Fulfilling Your Dreams and Reaching Your Destiny. (Think: The Alchemist with yogi-attorneys rather than a shepherd. In fact, Paulo Coelho, another one of my absolute favorite authors, said this about the book: A captivating story that teaches as it delights.)

Here are some of the Big Ideas:

1. The 7 Timeless Virtues - of enlightened living.
2. Invest In Yourself - Its a good investment. :)
3. Blueprinting - It starts in your mind.
4. Secret of Happiness - Do what you love!
5. Rise with the Sun - Tomorrow AM good?

So, heres to creating a gorgeous little blip on the canvas of eternity glowing with the radiance of honoring our ultimate purpose in life.

(More goodness--including PhilosophersNotes on 250+ books at[...])",2016-01-15,2016
5.0,0002008599,A very special book. Sharma shares his wisdom in a wonderfully simple book. Great lessons that can immediately be implemented into daily life.,2016-01-03,2016
5.0,0001712845,Timeless.,2016-12-19,2016
5.0,0001712845,This is one of my favorite books to read with preschoolers! They love completing the sentences when you read each page as they become familiar with the text. I have been a teacher for 30 + years and will always love this book!,2016-11-16,2016
5.0,0001712845,This was a cute children's book that I received in good condition.,2016-09-18,2016
5.0,0001712845,"My kids all loved this book, so I got it for my niece and nephew!",2016-09-17,2016
5.0,0001712845,A family favorite now buying it for my granddaughter. A great story the kids never could get enough of!,2016-08-25,2016
5.0,0001712845,"Glad that there are Berenstain Bear board books so I can start my son on the series early. It is an abridged version, so don't expect tons of pages. Great quality and size.",2016-07-25,2016
5.0,0001712845,A classic that my children loved and we are excited to read it to our granddaughter.,2016-06-15,2016
5.0,0001712845,I worked in daycare for 15+ years. We had this book and the toddlers just loved it. They'd ask me to read it again & again.,2016-03-12,2016
5.0,0001712845,"I Ioved this book as a child...now reading it to grandchildren!
It is a favorite of theirs!
The Spooky Old Tree.",2016-01-30,2016
5.0,0001712845,This is a family favorite bought for my granddaughter.,2016-01-16,2016
5.0,0001712845,A huge favorite with our sons when they were young. We borrowed it from our local library constantly and read it over and over. We bought this one for our Grandson.,2016-01-14,2016
5.0,0001712845,Another favorite in our house! All my kids have loved this book.,2016-01-09,2016
5.0,000105001X,"I first discovered this book in 1988, and the unique plot and impeccable historical research made me an instant fan of Ms Erskine. It's a story that will stay with the reader long after the final page, and I've reread it several times. I bought this one for a family member, in hopes she enjoys it as much as I have. She loved the Outlander series, and I told her this is a precursor similar in some plot points and just as exciting if not moreso. Kingdom of Shadows by Ms Erskine is also a keeper. A talented author and highly recommended!",2016-05-23,2016
3.0,000105001X,"It's an interesting premise, but I'm halfway through and finding the main characters annoying. It's dated, both in technology and the behavior of the main characters. Can't help feeling that this author 'almost' gets there.",2016-05-08,2016
5.0,000105001X,This was a great read. Once you started you did not want to put it down,2016-02-04,2016
5.0,0001473123,great book,2016-08-15,2016
5.0,0001473123,excellent,2016-05-31,2016
5.0,0001473123,I like it.,2016-05-04,2016
5.0,0001473123,Great book,2016-01-05,2016
5.0,0002163578,"The story of these researchers in the Kalahari is amazing and true! Incredible, the things they endure, all for their love of the animals, and their research into them is very valuable. Interestingly written; even though this is essentially a scientific work, it is not dry, but a wonderful story of how Man interacts with the Wild Side. I loved the hornbills in Camp, and, when I was just in Botswana, experienced for myself their mischievousness and wit.
I learned a lot from this book, which I was constantly telling people about!",2016-10-04,2016
4.0,0002163578,"I'm really enjoying this book but the scanning came up with errors that nobody fixed. ""Mark"" becomes ""Marie"" and there are ""scent maries""; they told ""yarn after yam"", ""AH"" instead of ""all"" and so forth. This slows down my enjoyment of the book.",2016-08-04,2016
4.0,0002163578,"It was exciting, but maybe a little more factual than a great story.
I read it before and while I was traveling to Africa to a game reserve, so it was definitely timely.",2016-06-20,2016
5.0,0002163578,"Its easy to see why Cry of the Kalahari was a bestseller.  It reads like an old-fashioned melodrama from the 1930s - as if Mark and Delia Owens were channeling Edgar Rice Burroughs.  Delia is trapped in a flimsy little tent by two huge lions!  Jeepers!  Delia and Mark are deep in the Kalahari desert without any water!  Oh no!  A raging wildfire is headed straight for their research camp!  Good grief!

Will our intrepid duo survive these perils?  Not to mention black mambas, surly rebels, and a diet of mealie-meal?  Tune in next week, or in this case, keep turning the pages for another thrilling chapter!

Seriously though, as a retired scientist (who worked in a nice climate-controlled laboratory), I have tremendous admiration for what the Owens did in Botswana.  Their dedication, perseverance, and attention to detail epitomize what field work is about.  COTK is not an account of their research findings, but a personal account of what it was like out there.

There is good science here.  Their discovery that brown hyenas breed communally was a fascinating achievement.  As well, the Owens comparison of lion behavior in the Kalahari with that observed by Schaller in the Serengeti was very important.  To have a comprehensive picture of a keystone predator like lions, we must know how they adapt to very different environments.  Well done, Mark and Delia.",2016-04-25,2016
4.0,0002163578,"This book was published 32 years ago, and many of the observations, research, and conservation recommendations in this book still obtain today, albeit with some major caveats. Through the emphases in their misadventures in the Kalahari, the authors give rather short shrift to what many of us would have wished to know about predator species. But, through inspiring and sometimes poetic prose, they manage to thoroughly engage the reader from the beginning to end of their dangerous adventure.",2016-04-15,2016
4.0,0002163578,Great book. Learned a lot about the subject.,2016-03-29,2016
4.0,0002163578,Great book.,2016-02-19,2016
1.0,0001945424,I found the book very hard to understand. I also saw a production of the book in a play. It is very odd and I would not recommend it to any one.,2016-12-31,2016
5.0,0001945424,daughter loves this book,2016-12-30,2016
4.0,0001945424,A classic good read even for adults. The characters are interesting. And show both good and bad  personalities. Enjoy it,2016-12-30,2016
5.0,0001945424,I gave this book to my grand children to read.  They loved it!,2016-12-29,2016
3.0,0001945424,"I have read several different versions of  this book and like it.  The  message  in the book is that the most unpleasant people can improve  if given a chance.

This version lacked the details contained in a hard copy of the book.  That is why I gave the book a 3 star rating.",2016-12-29,2016
5.0,0001945424,Excellent book.,2016-12-29,2016
5.0,0001945424,Wonderful story! What a treasure! I will let my daughter read i as well.,2016-12-29,2016
5.0,0001945424,Classic,2016-12-28,2016
5.0,0001945424,"A true classic! This has been one of my favorite books ever since I was a little girl! The courage and integrity along with the sweet innocence of this young but noble heroine will captivate the hearts of any who value such beautiful virtues. A heartwarming and delightful story, with a larger print than most books, making it easy to read and charming pictures!",2016-12-26,2016
4.0,0001945424,"The movie version is a favorite of mine and I thought it was time I read the book. The movie was pretty true to it, but the book is worth reading since it's more descriptive and you learn more about the characters and their time in the garden. Sometimes it was a bit too descriptive, but I just skimmed those parts. I will admit that reading the Broad Yorkshire accent as an American was hard at times since I couldn't always tell what things meant. Overall I liked the book and am happy to own it. It's truly a lovely story. I also really enjoyed towards the end where the author talks about how ruminating over negative things can cause the person to become negative and how helpful it is to just try to stay positive and think about pleasant things. I think that was the magic of the garden. It was able to bring 3 people out of their slumps and bring joy into their lives.",2016-12-25,2016
5.0,0002005379,My son loved this book. age 14,2016-07-06,2016
5.0,0002005379,"This book is great, I purchased it for my boyfriend's twelve year old son, and he absolutely loves it.  I am very pleased with the turnout.  This book also arrived in perfect condition, which is a huge bonus.  It is a little advanced for an average twelve year old, but I have a friend who absolutely loves this book as an adult.  I cant wait until he finishes reading this so I can read it for myself!",2016-04-27,2016
5.0,0002005379,Fun to read,2016-04-19,2016
