overall,asin,reviewText,time,year
5.0,0001713205,"This has to be the funniest book I ever read to a child.  I laughed so hard, I had to stop reading till I got myself under control.  I read it at a friend's home.  Then, I had to buy a copy for my own grandchildren.",2015-05-27,2015
5.0,0001713205,This was one of our 2 children's favorite story books.  I read it over and over and I never got tired of repeating the story night after night.  Now I have the pleasure of reading to our grandchildren with the same joy and delight.  It's fun and lyrical.  A family favorite for 2 generations!,2015-01-27,2015
5.0,0001950061,I put my butter on the up side!,2015-12-20,2015
5.0,0001950061,it is nice!!,2015-12-02,2015
5.0,0001950061,Just what we expected. Great condition,2015-10-17,2015
5.0,0001950061,"Great book. I used it as a sermon illustration concerning the need for peace. Great pictures, bold colors.",2015-09-07,2015
5.0,0001950061,"Oh, how can you not love a good Seuss?  If you liked Sneetches or Yertle, this will be up your alley.  Interesting kind of social commentary, but with the awesome inventiveness of Seuss.  It's a little violent- talking about blowing each other up and stuff... it is a book about battle, after all.  But I think it's valuable.  It's a pretty long story for Seuss.  Maybe stick to others for preschool aged children based on reference to violence and length, but you'll know what's right for your family.  And if you are just looking for another Seuss to add to your collection?  Do it.",2015-08-21,2015
5.0,0001950061,My Grandchildren love this!,2015-07-23,2015
3.0,0001950061,thanks,2015-07-15,2015
5.0,0001950061,I use many of his books for my guidance lessons in elementary school.,2015-06-28,2015
4.0,0001950061,"The book arrived and I was excited because it was a gift. However, the edges were all bent. The pages inside were fine but the outside corner edges were wrinkled and bent. Either it was like that when it was shipped out orbit was really beat up during the mailing process, not sure which.",2015-06-22,2015
5.0,0001950061,"Dr. Seuss satirizes the Cold War, but it really is a great story to discuss acceptance with children.",2015-06-18,2015
5.0,0001950061,"This book is amazing. Great message, great delivery. The people who have reviewed this saying that the message is for adults don't seem to understand how you teach values to children. No child would read this and be concerned about what a deep message was in it. But the deep message that it does deliver can help to show children early how war is not the answer.",2015-05-28,2015
5.0,0001950061,"Most people know Dr Seuss for his light-hearted children's books.  Fewer people know that he wrote highly political commentaries into some of his children stories.  The Butter Battle Book is a commentary on the Cold War, though it could be applicable to other wars, too.

Very good book.  It is extremely entertaining to read aloud.  The lilt and flow of the poetry is admirable and entertaining.  One of my favorite by Seuss.",2015-05-09,2015
5.0,0001950061,Book is perfect and super fast delivery.,2015-04-13,2015
4.0,0001950061,"I would give this to a High School student, studying the Cold War.  For a kids' book, it isn't very kid-friendly.",2015-03-11,2015
5.0,0001921517,"wonderful for children and adults, great condition",2015-12-09,2015
4.0,0001921517,Nicely done.  I would have appreciated an entry showing the density of renters in an insulae,2015-11-04,2015
5.0,0001921517,"good book, as described",2015-10-05,2015
5.0,0001921517,"Macaulay is the master of simplifying complex topics.  He's easy to follow, extremely well illustrated, and gripping -- which is a lot to be said for an historic architecture series! If you like to know how things work, buy any of his books.",2015-10-02,2015
5.0,0001921517,I bought this for my niece and nephew.,2015-10-02,2015
5.0,0001921517,awesome,2015-08-17,2015
5.0,0001921517,"A wonderful, illustrated overview that is good for adults and children alike.  Very informative, and now I would like a map of the location of buildings in Rome  to go with this book.",2015-08-11,2015
5.0,0001921517,FANTASTIC !!,2015-05-02,2015
5.0,0001921517,A very cool book that shows what a Roman city was like.,2015-03-26,2015
4.0,0001921517,Great help for school,2015-02-16,2015
5.0,0002112256,excellent,2015-05-04,2015
5.0,0002112256,excellent,2015-04-04,2015
4.0,0002006995,GRRRREAT!,2015-11-26,2015
5.0,0002006995,"Fantastic book, already starting on the next.",2015-04-16,2015
5.0,0002006995,great author,2015-02-19,2015
3.0,0002051850,"I will admit first that I am not an Ernest Hemingway fan. I think he's an overrated author.  I find his writing boring and too elementary.

With that said, this book was fairly entertaining.  There was a lot more to it than ""The Sun Also Rises"" for example.  This book actually has a plot, and an interesting one at that.  Hemingway spends a lot of time focusing on the love relationship that develops between the main protagonist and a young woman.  Unfortunately it is quite boring because I feel the woman is not a well developed character.

In my opinion, it's essentially a good short story that he stretched out with a lot of filler to be a novel.",2015-12-08,2015
2.0,0002051850,"I know it's a classic, but I couldn't relate to any of the characters, and decided not to even finish reading it. Just not enjoyable for me!",2015-12-03,2015
5.0,0002051850,"There are war stories and there are war stories.  Hemingway's reputation is solidified by this one, principally because of its alternating internal monologs, character constructions, and its fastidiousness of understanding of the Spanish Civil War.  You learn a lot along the way. In Homage to Catalonia, Orwell wrote ""first of all the physical memories: the sounds, the smells, the surfaces of things""  Hemingway has all of those in spades. I don't give 5s easily.",2015-11-26,2015
3.0,0002051850,"Hemingway was a fascinating guy, but an overrated writer. The book is good, but not great.",2015-11-20,2015
1.0,0002051850,"Because of the title and the author, I slogged through this...but I think it would be better in Spanish or not at all.  The sentence structure jumps a lot making it stifr (subj-verb, subj-verb). The narrations switch mid-sentence from third person to first person regularly. This may be to get the info to the reader and then jump in the head of the character, but it's confusing. The repetition is over the top. Again, it often shows the obsession of thought of a character, but it makes me want to jump to the next paragraph. Don't think I missed anything when I did that. I like some other of Mr Hemingway's literary contributions, and I do recall watching this movie when much younger, but ugh...Only finished because it was a looong plane ride and I thought I should to understand what others see.  Either I failed or EH did.",2015-11-10,2015
5.0,0002051850,Couldn't put it down.,2015-11-08,2015
3.0,0002051850,"This book is a little dated and the Spanish dialogue and the interpretation becomes a little tiring. The use of ""obscenity"" instead of the real word is cute but was a requirement in order to get published at that time.",2015-11-06,2015
4.0,0002051850,One of most difficult reads that I have encountered. Primarily because of the location and the use of Spanish phrases and individual words that need translation from time to time. All and all it was a really good story that just continued to get better as I got further into the story.,2015-11-03,2015
5.0,0002051850,This book really made me think.  Fantastically well written.  A great author at the heights of his ability.,2015-11-01,2015
4.0,0002051850,Good read had tendency not to put down,2015-11-01,2015
3.0,0002051850,Ok,2015-10-28,2015
4.0,0002051850,"This was the first Hemingway book I have read.  I really enjoyed it.  Yes, it is fairly repetitive at points with the dialogue.  But, it was a strong, rich story that I really truly enjoyed.  I plan on reading more Hemingway in the future.",2015-10-27,2015
5.0,0002051850,"Fascinating, OK, sometimes a little boring but a jewel for the English language. I realised two things; Whenever I had time I HAD to continue reading and I could not stop thinking, imagining what was happening in the book. A must for ESL students to broaden their vocabulary.",2015-10-23,2015
5.0,0002051850,great classic,2015-10-19,2015
5.0,0002051850,"Hemingway had a wonderful talent for writing romantic/love scenes. As you read it, it's strange to remember that this is all happening over the course of a few days. So much is going on inside with the characters: their thoughts and feelings about things. In some ways it's predictable, but I still enjoyed it.",2015-10-17,2015
5.0,0002051850,How someone can write so forcefully and completely and so simply baffles me. And I couldn't put this wonderful delicious friend of a book down.,2015-10-16,2015
4.0,0002051850,Compelling story about a small group of rebels in the sSpanish civil war 1936-39.,2015-10-10,2015
5.0,0002051850,If you don't know Hemingway this is a great start. Young writers can profit from his simple sentence structure.,2015-10-06,2015
3.0,0002051850,To much self introspection. A classic but dating!,2015-09-25,2015
5.0,0002051850,Book looks good and arrived in a short amount of time.,2015-09-12,2015
5.0,0002051850,"I enjoyed the book the whole way through. The different point of views through the different characters' writings was an interesting was to deveop the story line. As the story develops, the more characters you get to ""see"". Worth the read!",2015-09-04,2015
4.0,0002051850,"For Whom the Bell Tolls is a highly acclaimed war novel by master writer Ernest Hemingway. It was published in 1940 and tells the story of Robert Jordan, a young American in the International Brigades attached to a republican guerrilla unit during the Spanish Civil War. As a dynamiter, he is assigned to blow up a bridge during an attack. Hemingway describes the life of leftist guerrilla fighters in a series of skirmishes and camp fire vignettes; plunging the reader into a world of pine tree forests and counter intelligence. The characters of the morally repugnant and swine-eyed Pablo, as well as the strong willed Pilar, are indeed memorable. What sets this novel apart from othersis Hemingways own economical and inimitable style. Hemingway wrote without ornamentation  a symptom of his having been a journalist  and could evoke great emotion with his select choice of words. The recount of Sordos last stand, for example, is a particularly harrowing part in the book. Hemingways larger than life reputation preceded him when he was alive. He won the Nobel Prize for literature; as well as a Pulitzer prize for his Novella The Old Man and the Sea. Hemingways fiction seemed to fuel the legend that surrounded him as an author. He had served as an ambulance driver in WW1and much later travelled to Spain as a journalist to cover the civil war there; and no doubt his first-hand experiences inspired and helped to colour his writing. The book has various themes at its heart such as idealism and the fight against fascism (ie. fighting the good fight)as well as death in war, the transitory nature of life etc. The title of the book, For whom the bell tolls, comes from a line in a John Donne poem and is in reference to the symbolic funeral bell and the kinship all men share because of their mortality - No man is an island, entire of itselfFor whom the bell tolls, It tolls for thee.",2015-09-04,2015
5.0,0002051850,"Just a quick note: I recently reread this when I was reminded of the complexities of the Spanish Civil War by a magazine article.  The book did what I dimly remembered it did: it showed the local, human dimension of the war rather than the history book battle of ideologies we usually see.  What I hadnt remmbered was the subtlety and complexity  of the love story. Ive always thought Hemingways ability to present love has been underrated by many people who prefer to focus on the unwillingness of many of his characters to talk about their feelings.  Its true, his characters generally don't have much to say on the subject, and even their inner monologues tend to be sparse, but Hemingway still manages to express his characters deep, vital and nuanced feelings. I think the lack of verbiage is part a reflection of the view expressed by many of his characters that it doesnt do to talk about significant things too much and part the simple fact that the characters themselves don't understand what they're feeling.
Hemingway was a fabulous writer, and much of his work, though clearly rooted in his time period, still stands up to scrutiny today.",2015-09-02,2015
5.0,0002051850,Excellent  book.  No one writes like Hemingway.  Every dedicated reader ought to explore his work.,2015-08-31,2015
5.0,0002051850,Incredible story. Classic. Must read. Hemingway at his best.,2015-08-28,2015
4.0,0002051850,"After finishing this book I feel like I want to read it again in order to fully appreciate it.  The book's dialogue is written in English but is describing conversations that are occurring in Spanish.  So Hemingway writes in formal old English and following the syntax of the Spanish language.  This makes it a more authentic experience but somewhat more difficult to read.
Most of the story concerns the thoughts of the main characters as they prepare themselves to die in battle very soon.  So be prepared for a depressing set of thoughts and expressions.",2015-08-21,2015
5.0,0002051850,"For Whom the Bell Tolls is not the first Hemingway I've ever read.  That would be Hills Like White Elephants, which, like most US college students, I had to study in my short stories class.  Now, roughly 13 years later, I've been attempting to go back and read all the classics that my high school and university professors tried to get us to read.

For Whom the Bell Tolls is a gripping read.  Once you make it about a third of the way you will be hooked until the end.

As this is considered a classic, I read it with a slow, active reader's eye, paying as much attention to the prose and word choice as anything else.  The dialog is superb, even in spite of Hemingway's controversial choice of having the characters speak in an Old English style.  Reading it quickly becomes second nature.  Never have I seen so much character imbued in dialog.

Hemingway also doesn't overload the reader with details of setting.  He gives you just enough detail that you can project your own mental image and get on with the plot.

The action is well described.  Hemingway himself was involved in fighting in several wars, and his familiarity with combat really shows through in the battle scenes.

The prose isn't perfect.  Though Hemingway exercises his typical avoidance for large, ornate words, descriptions and dialog can be nonetheless wordy and flowery.  Pilar's description of the smell of death dragged on for pages, and was useless besides since her palm reading served the same plot purpose.  There are other passages in the book where I felt like Hemingway indulged a bit too much in wordiness.

That leads to the book being a touch too long.  If the wordiness had been wrangled in a bit and certain subplots excised, I think the book would have been a much tighter experience.

Still, I think it's an excellent book.  It's definitely one that you will remember.",2015-08-20,2015
4.0,0002051850,"This is my favorite by Hemingway thus far. Loved all the characters, all seemed very life-like. Enjoyed his mastery over writing the characters dialogue, their exact Spanish dialect. Different, but enjoyable. Definitely liked the main character, Robert. Wish the ending had been different, though. I wanted a happy ending, I suppose, where they all got away. That's why I gave it 4 stars. I'd recommend it to all whom love classic novels, as well as historical fiction, action, or war novels. Many would love this book.",2015-08-20,2015
5.0,0002051850,Great read.,2015-08-20,2015
4.0,0002051850,"Hemingway is an extremely famous author but for me, some of his books do not live up to the legend. This, however, is my favourite. Just read it.",2015-08-15,2015
4.0,0002051850,My friends hate Hemingway because of Old Man and the Sea. I promise you this book isn't another required reading snooze fest. This reads better for youth. I couldn't put it down during summer after my Junior year of high school.,2015-08-11,2015
5.0,0002051850,I hate this book but he service was great. I had to read it for a history class. It's good if you like this genre or this writer but I wasn't crazy about it,2015-08-07,2015
5.0,0002051850,One of the great novels of all time.,2015-08-06,2015
5.0,0002051850,"This is one of Ernest's best books, about love, war, life and the dangers of death in warfare. Written  just three years after the Spanish Civil War, it puts the human cost of conflict in perspective, involves, betrayal, and the naive notions of trust in a difficult world.  As with many of his earlier books, For Whom the Bell Tolls, is the story of love and devotion,  cut short by chance, and world forces that were girding for the Second World War. (Germany and Italy both sent ""volunteers""  to fight the Spanish Loyalists under Franco, a brutal dictator.  Still as fresh and engaging as when it was released in 1940. If you love good writing, get, For Whom the Bell Tolls.",2015-07-30,2015
4.0,0002051850,Another classic book that you must read,2015-07-14,2015
5.0,0002051850,A real masterpiece. Couldn't put in down. I look to re-reading certain of his other works,2015-07-13,2015
5.0,0002051850,This book provided some insight into the Spanish Civil war that caused me to do some research; and verify. My previous interest in the Spanish Civil War was the popular version that it was dominated by Germany and Italy. Specifically the trial of their weapons and tactics. I now know that the Russians were very involved on the Republican side and used this conflict to try their terror tactics and political manipulation.,2015-07-01,2015
5.0,0002051850,What more can be said,2015-06-28,2015
5.0,0002051850,"I read this on the heals of Amanda Vaill's very good book ""Hotel Florida"" (Farrar, Strauss 2014) describing the Spanish Civil War of 1936-39 through the experiencing of it by Hemingway and others as correspondents and photographers.  Hemingway wrote this in 1940 with resounding success.

A young American professor who teaches Spanish at a university in Montana signs on as a partisan volunteer.  It's because he's anti-fascist more so than being pro-Communist.  This is Robert Jordan a demolitions expert, a skill he learned after arriving in Spain.  He's known now as a dynamiter.
He becomes part of a small group, 8 or 9 insurgents, hiding out in the mountains near Segovia making their home in a cave.  They are a motley group, which is part of the charm of the novel.  The dialogue between them and Jordan is a major part of the story.  Who can be trusted?  Who has the nerve to carry out their responsibiltiy?  Can this person be depended on or should he be knifed or shot?  It's rich with characterization.

Marie has been brought into the group.  Young, charming, and having been sexually abused and hair growing out after having been cut off as part of the cruelty inflicted on her.  She and Roberto are a match from the start.  They pledge their enduring love.

Roberto's assignment is to blow up a bridge in the hinterland.  This  is easy enough.  Two guards are on duty at all times and 5-6 others are billeted close by to take their turns.  They can be eliminated.  The problem is that the bridge must be blown at just the right time; as soon as Roberto hears the bombardment that signals the Spanish attack.  The purpose is to cut off the resupply of the rebel (Franco's) forces which must cross over the bridge to get to the battleground.  Blow it too soon and the rebels will be alerted and throw pontoons across; the element of surprise is lost.  Too late, and the rebels will be crossing the bridge and it will be impossible to take out the bridge.  To compound Robert Jordan's problems  a traitor in his group has stolen all the dynamite caps.  Not only must the dynamite be fastened in place under the bridge at the key places in the structure, but it must be detonated by hand grenades with the triggers pulled by long thin strings to places of shelter on the shore.  And the guards have to be eliminated before any of this.

Hemingway is at his best in building suspense.  Can they kill the guards?  Can Jordan attach the dynamite and the grenades?  Will it work?  Can he get it done before the bombardment signals that the bridge must be blown?  Can they escape?  Is Marie safe (she's guarding their horses)?

Don't expect this book to make you a historian of the War, but it will acquaint you with backwoods guerrilla war, the atrocities, the idiocies, the evil that corrupts a soldier's soul.",2015-06-27,2015
5.0,0002051850,"Outstanding war novel, colorful and consuming description of atmosphere within a guerrilla group during civil war, mixed with human stories, philosophy, and some romance",2015-06-25,2015
3.0,0002051850,"I enjoyed the story, but it could be slow at times.  I prefer Hemingway's ""The Old Man and the Sea"".",2015-06-24,2015
5.0,0002051850,"There are only a few books I've read more than once or twice, and this is one of them. I come back to it every year. I remember it as if I'd breathed the air the myself and had my own feet on the ground. It's an amazing thing.",2015-06-21,2015
5.0,0002051850,Excellent character development and a look into an almost forgotten piece of world history. One of the best war novels I have read.,2015-06-18,2015
5.0,0002051850,I read exerpts from this book in college but never finished the whole thing.  Sorry that I took so long to read it in its entirety.  Excellent read. Great characters and an ending that made me want to cry.,2015-06-17,2015
5.0,0002051850,I started this book but had to set it aside as I had another one assigned to read first.  Will get back to it soon I hope.  Enjoyed what I did read.  Obviously Ernest Hemingway does not need any kudos from me as this is a classic.,2015-06-13,2015
4.0,0002051850,"Hemingway was a bit wordy in this book, albeit appropriate.  Took a bit to read.  I liked his other novels better, but one should certainly read this one too...",2015-06-06,2015
5.0,0002051850,sad but  sweet story,2015-05-29,2015
5.0,0002051850,"This is not an easy read, but is a most rewarding read.  Written as a translation from familiar Spanish, the 'thee's and thou's"" may take the reader a bit of time to get used to. Hemingway makes a number of statements during the book about religion that were interesting.  For the last 10% or so of the book, I couldn't put it down!  Powerfully written, it is in every way a classic well worth reading.",2015-05-29,2015
