overall,asin,reviewText,time,year
4.0,0001844423,"Love this series. Have read it to all my kids, probably several times.  Now starting to read it to the grand kids.",2016-08-28,2016
5.0,0001844423,Excellent books,2016-08-27,2016
5.0,0001844423,Terrific book. I'm an old woman and I still love reading Narnia. C. S. Lewis was the best!,2016-08-24,2016
5.0,0001844423,C S Lewis children's classic which should be read by all adults.  This series does not talk down to children and insult their intelligence like so many books written for children.  Beautifully written by one of the world's best apologist. A must read.,2016-08-23,2016
5.0,0001844423,I ordered this as a chapter book for me and my son to read together. He is 7 and loves the stories and adventures! It has opened up conversations with us and given us a positive experience. He looks forward to reading it every evening.,2016-08-22,2016
5.0,0001844423,"No review is necessary for the Chronicles of Narnia series. It has withstood the test of time and proven itself a classic. I enjoyed them as a child, reading and rereading them all. Now as a father, I get the joy of reading them with my daughter, and once again I find myself drawn back into Aslan's world and enjoying ever second of it.

The boxed set was an incredible value. The books are about the quality of mass market paperbacks, in other words, not high quality. But they are good enough quality and I was able to get the whole set for under $20. So I am quite happy with the purchase.",2016-08-17,2016
5.0,0001844423,"Reader thoughts: An escape in the night, an abandoned castle, ancient ruins, a thwarted murder, a near-drowning, a werewolf, and a final duel. This book sounds like horror, but it's not. Part of that is probably because most of it is told through the story of a dwarf.

I love the bear sucking his paw. I love Reepicheep and his tail. I love the teacher drawn into the dancing and singing parade. I love that Edmund forgets his flashlight. I love that the dwarf has to run to Aslan. I love that the Telmarines were descendants of pirates.

Caspian says, ""I was wishing that I came of a more honourable lineage.""
Aslan replies, ""You come of the Lord Adam and the Lady Eve. And that is both honour enough to erect the head of the poorest beggar, and shame enough to bow the shoulders of the greatest emperor on earth. Be content.""

Writer thoughts: Why is it that some books can be read over and over without exhaustion, and some books need only be read once? Is it the reader's preference, or is it something the writer has done to the writing or story?

I suspect it is both. In the case of the Narnia books, I daresay the credit belongs to Lewis. His characters are real and complex, and his writing style is simple. I mean that it doesn't try to make the reader guess what's happening or why. It doesn't try to use fancy wording or strange metaphors with lots of purple prose.

What are some other things Lewis does that make his books timeless?

Happy endings. Clear good and evil. Problems relatable to our world. The frankness of the dialogue (on-the-nose dialogue is usually a bad idea, but his works well).

The number one factor, though, is probably nostalgia. So many people have read these as young kids and remember them from that. (This can't be the only aspect because there are plenty of children's books that aren't worth reading over and over and over.)

Without Lewis's books, I would argue that a book needs subtlety and layers in order to be enjoyed again. I would have said a book needs to hide a few discoveries in its folds so that readers can find them the second time through (like foreshadowings). However, Lewis shows that's not strictly necessary.",2016-08-16,2016
5.0,0001844423,"Reader thoughts: I love that Aslan is singing to make the world! I love that Digory admits he was wrong to ring the bell and that he wasn't really enchanted. I love when he comes out of the pool and tells Polly he's been there forever. I love that Uncle Andrew is planted. I love that the witch can't do magic in London. I love how Polly and Digory meet. I love that the Jackdaw was the first joke. I love that they planted the toffee tree.

I love that Digory wants so badly to use the apples for his mother and that the witch says the excuses we think ourselves. Here's a paraphrased conversation between him and the witch.
Witch: ""Use the apple to make your mother well.""
""Oh!"" Digory put his hand to his head. For he now knew that the most terrible choice lay before him.
""Cruel, pitiless boy! You would let your own Mother die!""
""But I promised!""
""But you didn't know what you were promising.""
""Mother would tell me not to, if she were here.""
""She need never know.""

Writer thoughts: CS Lewis knows how to write about the hearts of people. I haven't found another author better at writing about what really goes on inside the depths of humans' souls. Orson Scott Card reveals candid glimpses, but it's nothing as consistent as Lewis. What makes me say Lewis does this so well?

Think about Terry Pratchett's explanation of second thoughts (and third thoughts and fourth thoughts). He shows a little of what humans are thinking behind the first layer of thinking. CS Lewis discusses these innermost thoughts quite casually, throwing them in his prose for all readers to consider.

If you saw your enemy drowning, your first layer of thoughts might be, ""Somebody help him!"" Everyone really is a decent human being on the surface. The next layer might be, ""I should help him,"" but is your compunction here strong enough to overcome the third thoughts (""He deserves to drown"") and your fourth thoughts (""I'd probably drown and cause more harm than good"") or does your enemy drown? Perhaps there are fifth and sixth thoughts helping you decide what to do in that moment, too.

The thing is, many authors focus on the first layer of thoughts (if they breach inner dialogue at all). Other authors let readers glimpse second and third thoughts. Very good authors make the readers aware of fourth thoughts, even if they don't always state them. CS Lewis consistently lays bare all layers of thoughts/motivations/feelings/impulses/instincts that his characters have at complicated moments.

That's the key, though. He picks just the right moments, when his characters are in full moral dilemma, to show readers how conflicted the characters are.",2016-08-16,2016
4.0,0001844423,Great for kids. The stories are predictable if you are at all aware of the biblical influences in the books. The dramatization is fun for the kids to hear and helps make car trips pass more quickly.,2016-08-15,2016
5.0,0001844423,These are so beautiful! Purchased them used and they're in such good condition. Can't wait to go back to Narnia!,2016-08-14,2016
5.0,0001844423,A fun read especially if the whole family reads it together.  It really takes your mind to another place.  Love it!,2016-08-13,2016
5.0,0001844423,My favorite books. Great purchase,2016-08-11,2016
5.0,0001844423,"Chronicles of Narnia is a classic set of stories--not just for children, but for adults too. Full of deeper meaning and still great stories, this series is a must read for all ages.",2016-08-09,2016
5.0,0001844423,Well I read the second boo  before the first book an  I believe that it made this book so much more fun and exciting. It was a great story with a lot of twists.,2016-08-08,2016
5.0,0001844423,"I read these as a child and purchased the set for my kids.  I re-read them and they are just wonderful, fun books full of adventure and at the same time teaching character and values.  If you are a Christian or familiar with the Bible, you will see analogies throughout.  Wonderful books for mid-elementary to read to themselves and for parents to read for the younger ages.",2016-08-06,2016
5.0,0001844423,"My son loved the book. He had wished he read this one before the lion, the witch and the wardrobe. Great book.",2016-08-02,2016
5.0,0001844423,As an adult it was great to go back through them.,2016-07-30,2016
5.0,0001844423,I love this story!,2016-07-30,2016
4.0,0001844423,"I never read this series as a kid, but I do love reading as an adult.  I recommend them to adults and kids.",2016-07-30,2016
5.0,0001844423,"Let's be honest, sometimes Amazon gets it wrong; however, in this case, Amazon TOTALLY got it right!! I was really skeptical about the condition of the book. I didn't trust that I could really pay close to $12 for something worth so much more. The reviews seemed legit, but I couldn't be totally sure. In any case, I was prepared to ship it back for a refund in case it wasn't what was advertised. Luckily for me, I was wrong. The dust cover was the only thing that was a little jacked up, but even then it wasn't severe. I don't really care about dust covers anyway, so I just threw that away. The book itself is in PERFECT condition. It is a book that is worth $50 or more, but it is being sold for such a bargain price! You cannot go wrong with this purchase. Honestly. Best Amazon purchase ever.",2016-07-28,2016
5.0,0001844423,old favorite,2016-07-28,2016
5.0,0001844423,One of my favorite book series!! I'm 42 and I still pick these up from time to time and read. This set I bought for my twin 13 year old nieces. They were very excited!,2016-07-27,2016
1.0,0001844423,"If I had the energy to describe how bad this is, I still wouldn't be able to describe how bad this is.",2016-07-26,2016
5.0,0001844423,"Thoroughly entertaining, and insightful.",2016-07-26,2016
5.0,0001844423,C.S.Lewis. everyone should read all the short stories in this collection.  The writing style is different from today.,2016-07-25,2016
4.0,0001844423,Good read. I bought the set for my incoming 6th grader's summer read and ended up reading it myself. I enjoyed reading the books. The author was very descriptive and felt like I was immersed in the wonderful world of Narnia. I couldn't stop reading after I got started.,2016-07-25,2016
4.0,0001844423,"Great story and characters, 8-10 year old read.",2016-07-24,2016
5.0,0001844423,This series is fantastic in every way...the audio and sound effects the actors and actresses truly take you into another place...this is a wonderful gift not only for children but adults as well.,2016-07-20,2016
5.0,0001844423,Perfect,2016-07-20,2016
5.0,0001844423,Ty,2016-07-20,2016
5.0,0001844423,Great book,2016-07-18,2016
5.0,0001844423,"These are my grandkids favorite books so I had to give them a very good set they could keep forever. C.S. Lewis is an excellent author even in today's times. Why would they make movies of these stories if it wasn't still a classic today!  I love all his books!!  All 16 of my grandkids have loved these stories. So if you are looking for a some good stories for the kids with a wonderful moral to the stories, I highly recommend them.",2016-07-18,2016
4.0,0001844423,"This is a good read for anyone in grades 1 and up.  It is a good reread for any who have read it when they were younger.  Even though they may have started with The Lion, The Witch, and The Wardrobe.  And I had never known this before I became a believer, but it is based on the Bible (to a certain extent).  If you want another series to read, I would recommend The Left Behind series (either the adult series or the kids series).  I have only read the adult series.",2016-07-11,2016
5.0,0001844423,I really liked the book. But then I like C.S. Lewis as an author,2016-07-09,2016
5.0,0001844423,When my children were small I would sit and read to them at night about Narnia until all the books fell apart (they had been mine as a child). Then I saw the chronicles in Walmart in one volume and picked it up and we (my 5 and I) read it until the spine broke and the pages began to fall out! So I bought another on a different website this one for my daughter who intends to teach second grade and is leaving this fall for collage and has personally read the books probably I or more times and watched the movies so.many ti.es we have had to replace the. Twice as well too! Then I decided I better get myself a new copy for my own use to read to my grandchildren and so I bought this copy on Amazon.com and then I LAMINATED THE COVER AND SPINE!,2016-07-07,2016
5.0,0001844423,"This was a gift to my niece.  I loved them when I read them, and I knew she would too.  She did.  Books for young people don't get any better than this.",2016-07-06,2016
5.0,0001844423,Incredible read as a child; even more meaningful as an adult.,2016-06-28,2016
5.0,0001844423,Wonderful book would recommend it to all.,2016-06-28,2016
5.0,0001844423,Beautiful,2016-06-27,2016
5.0,0001844423,I already have a copy of this book but wanted to own this beautiful cover series. Amazing artwork!,2016-06-26,2016
5.0,0001844423,"I love these books.  I think the dedication in ""The Lion, the Witch, and the Wardrobe"" is so accurate when it says that one day Lucy will be old enough to want to read childish books again, and I've definitely reached that age with this one.  It's definitely suitable for younger ages, but you will pick up new details and themes as an adult.  C.S. writes at a quick pace and doesn't hang you up on too many details, while still managing to be a deep thinker and writer.  I really enjoyed these!  The book itself is light, but big.  I was glad to have them all in one book, but it wouldn't have been as portable if not for my massive handbags.",2016-06-26,2016
4.0,0001844423,NOt bad,2016-06-22,2016
5.0,0001844423,"What more can be said about Lewis's awesome children's series? The imagination he shows, and the positive messages he conveys make this a must for the library of every child age 5 to 5000. I enjoyed reading these books to my children when they were young (about age eight). When they got older they picked them up again on their own to enjoy the stories again (as teenagers).",2016-06-20,2016
5.0,0001844423,"Of course I loved the books growing up, but sadly my husband has never read them!
I got these for him to listen to on his hour and a half commute to and from work. He loves it!
I wish they could somehow condense the disks a bit so he wasn't always changing them. But I understand why not.",2016-06-20,2016
5.0,0001844423,Just as described. Would order again.,2016-06-18,2016
5.0,0001844423,waiting for my boys to get older to read,2016-06-17,2016
5.0,0001844423,"The person who's been reading through The Narnian Chronicles will find in this final book of the 7 a difference in tone - a foreboding - right from the start. I'll try not to spoil anything with details; the story is good, but quite different than the others. Like the others, there are many quotable lines that show wisdom and spiritual maturity, and deserve to be pondered and shared. For example, one enticing line (paraphrased from memory) is: ""Everyone receives what they truly seek.""

The Last Battle contains much of Lewis's theology of heaven (which he more fully explored in his novel ""The Great Divorce"" (the ""divorce"" is the separation between Heaven and Hell)), as well as in some of his stand-alone essays on the subject. We see who (Lewis believed) arrives in heaven and who does not, and why. We see a kind of purgatory, and his view of ""the new heaven and new earth"" of Scripture. We see what is allowed and not allowed in each (though it is not always explained just why some of the allowances and restrictions exist). He provides some great metaphors for the afterlife (Good and Evil) which are worth meditating on and appreciating.

Many who agree with the rest of Lewis's theology will disagree with some of his theology about heaven. But, as he says in one of his essays about belief in the Satan and demons, these are not crucial to the faith, they are opinions which he believes are the best answers we have at this point, and his faith (and ours) will not be thrown on the rocks if we discover the details to be otherwise.",2016-06-13,2016
5.0,0001844423,its a classic children's series.  i love it even as an adult,2016-06-09,2016
5.0,0001844423,C. S. Lewis has an amazing talent for creating spell binding and unique stories.,2016-06-06,2016
5.0,0001844423,A great edition of The Chronicles of Narnia!,2016-06-06,2016
5.0,0001844423,Awesome series!,2016-06-05,2016
5.0,0001844423,AWESOME!!!,2016-06-04,2016
5.0,0001844423,Children and grown ups alike will greatly enjoy this book. This is my favorite book of the series. C.S. Lewis has an amazing ability to bring books to life.,2016-06-04,2016
5.0,0001844423,My grandson has read the books and is now listening to the audio. A good quality production of the epic story.,2016-06-04,2016
5.0,0001844423,"This book was well worth the money!  The narration was so good that it wasn't ""narration"" it was dramatic story telling.  I wish that all narrators were this good!",2016-06-03,2016
5.0,0001844423,"AWESOME!!! I daresay I liked this so much that it was on par with reading the books, but I'll have to read them again, it's been a long time. The movies were absolutely terrible compared to this in my opinion, possibly in general - major let down. But radio drama, and these stories in particular, were awesome!!!! My wife and I had such a blast listening to these.

This is a side note, but the actor for Aslan is WAY better than Liam Neeson (played Aslan in the movies). I found this stunning because Neeson has such a great voice, and generally I really like Neeson, so I thought he was going to do great in the movies, but he was just a flop. I'm telling you that the actor for Aslan in these radio dramas was FANTASTIC! You really get a sense for the depth and character or Aslan, so that you perceived multiple aspects of his personality, the way that C.S Lewis wanted. C.S. Lewis was a Christian, writing a Christian related series of books after all. I found Neeson to be very one dimensional in the movies, just monotone, and boring. I partially think this had to do with the directors of the movies having no interest in portraying Aslan as his true representation of God, in all His glory, majestic, and depth of character, but this is pure speculation on my end. Granted, there is a lot more that makes this series great, but I was just really surprised by this bit.",2016-06-01,2016
5.0,0001844423,"I love all the Narnia books, but this is the best! CS Lewis is my favorite author, and I consider this book to be one of his top five books.
My personal favorite CS Lewis books are: Mere Christianity, The Great Divorse, Screwtape Letters, Perelandra, and The Last Battle.",2016-06-01,2016
5.0,0001844423,I LOVE this series.  Started reading it to my children when they were about 5.  It's a great message for kids and adults and interesting reading to both.,2016-06-01,2016
5.0,0001844423,"classic set of books that only the second one gets read, read the series you will learn a lot about the complexities of being human",2016-05-31,2016
5.0,0001844423,My wife recommended this as I had never read the series.  i wish I had read these years ago.,2016-05-30,2016
5.0,0001844423,"This is a prized possession of mine.  I love anything to do with C S Lewis and the Chronicles of Narnia, and since I have many hobbies that take my visual concentration, yet leave me wishing for some audio interest, I find myself returning to these stories and this series time and time again.  I have several different versions of the audio books, and each are individual and unique... The Focus on the family series paints such a lively picture in your mind with exceptional quality and audio clarity.  The BBC collection is also excellently performed, complete with music and sound effects, and it was such a pleasant surprise when I stumbled upon that production....I had no idea it was ever made until about a year ago.

This, however, is the quintessential Narnia audio collection, direct from the pages of C.S. Lewis, word for word, unabridged, and so respectfully compiled.  I love the actors' renditions of the stories, each beautifully read, and the English accents add such an authentic flare.  My 2 favorite stories...(though I love them all!)...are ""The Lion, The Witch & The Wardrobe"" (narrated by Michael York), and ""The Last Battle"" (narrated by Patrick Stewart).  These actors truly show off the full range of vocal talents. It is such a joy to live in a day and time where so many versions of these beloved stories are available to us to relive, enjoy, and share with the next generations.  My children will be introduced to the stories at a young age and will cherish them as much as I do, I have no doubt.  It is a classic series, and the stories will live on forever  in literature.  I only wish I had been alive and able to meet CS Lewis.

On a side note:  Coloring in adult coloring books is one of my newest craft hobbies, and these stories are still in my list of favorites to listen to while relaxing with my artwork.  I find that the combination of craft and listening to stories is exceedingly calming and inspiring.  It's like having a friend who sits in your room reading to you.",2016-05-29,2016
5.0,0001844423,"great book, looking forward to the next books",2016-05-27,2016
5.0,0001844423,"Naturally a wonderful set, worth the read and money.",2016-05-22,2016
5.0,0001844423,"So much has been written about the Chronicles of Narnia. I loved them as a child and we are enjoying sharing them with our 7-year-old twin boys now.

Five stars for Lewis. HOWEVER, I do not love this edition. I read so many reviews and lost track of which edition had the books in my preferred order. I know people can have strong opinions about this. ;) I personally much prefer the series in order of publication and this edition has the books ""out of order.""",2016-05-19,2016
5.0,0001844423,"This took awhile to receive, but worth the wait.  I bought it for my husband and he was very pleased with the set.  He's reading them to our five year old and he's loving Narnia!",2016-05-13,2016
5.0,0001844423,"This book is one of my favorite of all times.
I have read it almost as much as I have seen Babylon 5,  one being from space and the other from the imagination more than I could hope for.",2016-05-11,2016
5.0,0001844423,Enjoyed Prince Caspian very much!  Finally reading these books I've hear about for years.,2016-05-11,2016
5.0,0001844423,Kids enjoy listening to these stories during car rides.,2016-05-10,2016
5.0,0001844423,Love these books. Magical and beautiful.,2016-05-09,2016
5.0,0001844423,A wonderful read!,2016-05-06,2016
5.0,0001844423,"love all things CS Lewis! We have really enjoyed reading this series with the kids (8, 6, and 3).",2016-05-05,2016
5.0,0001844423,Great favorite book or should I say set of books took me back to childhood years . I had forgotten how much I enjoyed them .,2016-05-02,2016
5.0,0001844423,"This series of books is a MUST READ for every child (and adult).  I found them when I was 12 and enjoyed reading them over and over.  I read them to all of my five children, and they loved them.  This book was purchased for my new grandson...as a cherished thing to be shared with a new generation!

I have friends who are not Christians who LOVE these stories for their creativity and adventure.  My Christian friends and I love the allegory, representative of Christ.  We like to discuss that as a family, but it does NOT have to be pointed out at all, and not discussing it does not take away from the story. In fact, over-discussing it can take away from the story.  I found it best for my children to discover the allegory themselves.

This is ONE large volume with all the books.  It is NOT filled with photos.  I think this is good...read the stories and allow the children to picture them in their minds.  Kids nowadays spend too much time with videos/ visuals anyway.",2016-05-01,2016
5.0,0001844423,Excellent,2016-04-30,2016
5.0,0001844423,"I have loved this series since I was a child. I have read it several times. As a kid I didn't realize that it was a Christian analogy. As an adult I find that it is well written in this regard. As a kid I liked the adventure stories. As an adult, I like the complexity of the characters and situations. It is quite possibly the best children's series ever written. I have just started to share it with my own children, aged 5 and 7 and they are excited to read it every day. I do suggest if you are sharing it with your children start at The Lion Witch and Wardrobe instead of the Magician's Nephew, and then go back and read the Magician's Nephew later.",2016-04-30,2016
5.0,0001844423,"I absolutely love this collection! In fact I only even bought this edition because we wore our other copy out completely! The cover fell off years ago and whole chunks of story were falling out from decades of use. I'm all grown up now but I am still so in love with this story. It never gets old! I really wish someone would make a Magician's Nephew movie. It all ties together so beautifully when you know the whole story. This copy is gorgeous with the Dawn Treader on the front, it's still a paper back, so there's a real chance we'll wear this copy out too, but thus far it's holding up really well.",2016-04-29,2016
5.0,0001844423,This was a holiday gift and it was a great present. The stories are good for all ages.,2016-04-28,2016
5.0,0001844423,Highly recommend the Chronicles of Narnia series by C S Lewis. I have read through them several times.,2016-04-23,2016
5.0,0001844423,WOW LOVE IT.!,2016-04-22,2016
5.0,0001844423,Classic C S Lewis.,2016-04-22,2016
